{
  "case_id": "challenger-launch-1986",
  "hook": "당신은 엔지니어입니다. 내일 아침, 사람을 태운 로켓이 발사될 예정입니다. 그런데 오늘 밤 기온이 이 로켓이 지금까지 날았던 그 어떤 조건보다 훨씬 낮게 떨어지고 있습니다. 당신 팀이 설계한 부품 하나가, 정확히 얼마나 추워지면 제 기능을 못 하는지는 아무도 모릅니다. 다만 지난번 가장 추웠던 발사에서, 그 부품이 지금까지 본 것 중 가장 심하게 손상됐던 기록이 있을 뿐입니다. 발사를 미루자고 말할 것인가, 아니면 지금 가진 증거로는 확신할 수 없다는 상사의 말에 따를 것인가.",
  "short_setup": "1986년 1월, 미국의 우주왕복선 챌린저호는 이미 여러 차례 연기된 끝에 발사를 앞두고 있었습니다. 그런데 발사 전날 밤, 기상 예보는 기존 발사 기록 중 가장 추웠던 온도보다도 훨씬 낮은 한파를 예고했습니다. 로켓 부스터의 이음매를 밀폐하는 고무 오링(O-ring)을 설계한 모튼 티오콜사의 엔지니어들은, 1년 전 가장 추웠던 발사(약 섭씨 12도, 화씨 53도)에서 이미 오링 손상이 가장 심하게 나타났던 것을 알고 있었습니다. 이번엔 그보다 훨씬 더 추울 예정이었습니다. 발사 전날 저녁, 티오콜 엔지니어들과 경영진, 나사(NASA) 관계자들이 전화 회의로 모였습니다. 결론은 두 갈래로 갈렸습니다.",
  "why_option_a_made_sense": "설계와 시험 데이터를 가장 잘 아는 사람들, 즉 오링을 직접 다뤄온 엔지니어 로저 보이졸리와 알란 톰슨은 화씨 53도 아래에서는 안전을 장담할 데이터가 없다고 분명히 말했습니다. 이제까지 가장 추웠던 단 한 번의 발사에서 최악의 손상이 나왔다는 것은, 아직 아무도 시도해보지 않은 더 추운 조건에서 무슨 일이 벌어질지 아무도 확실히 알 수 없다는 뜻이기도 했습니다. 불확실한 상황에서는 검증되지 않은 극단적인 조건을 피하는 것이 공학적으로 자연스러운 선택이었습니다.",
  "why_option_b_made_sense": "반면 나사 마셜 우주비행센터의 관리자들 입장에서는, 그 밤에 제시된 근거가 얇아 보였습니다. 데이터는 단 한 번의 저온 비행 기록뿐이었고, '몇 도 이하는 위험하다'는 식의 명확한 수치 기준도 없었습니다. 게다가 오링에는 하나가 새더라도 두 번째가 버텨주는 이중 구조(보조 오링)가 있었고, 이전 비행에서 손상이 있었어도 실제 폭발로 이어진 적은 없었습니다. 이미 여러 번 미뤄진 임무를 놓고, 확실치 않은 단일 사례만으로 또 연기하는 것은 관리자들에게 지나치게 신중해 보였습니다.",
  "actual_decision_explanation": "전화 회의 중 나사 측이 강하게 반박하자, 티오콜은 자기들끼리만 따로 논의할 시간(약 30분)을 요청했습니다. 이 비공개 논의에서 선임 부사장 제리 메이슨은 기술담당 부사장 로버트 런드에게 '엔지니어의 모자를 벗고 관리자의 모자를 쓰라'고 말한 것으로 알려져 있습니다. 이후 티오콜 경영진은 입장을 뒤집어 발사를 승인했고, 보이졸리와 톰슨 등 반대했던 엔지니어들은 최종 서명 과정에 참여하지 못했습니다. 이 결정은 그날 밤 자정 무렵 나사에 팩스로 전달되었고, 나사의 상위 책임자들에게는 그 이면의 격렬한 반대가 얼마나 컸는지 제대로 전달되지 않았습니다.",
  "outcome_story": {
    "immediate": "다음 날인 1986년 1월 28일, 챌린저호는 발사 73초 만에 공중분해되었고, 탑승했던 승무원 7명 전원이 사망했습니다. 이후 조사위원회(로저스위원회)는 사고 원인을 오른쪽 고체로켓부스터 이음매의 오링 밀폐 실패로 결론지었으며, 실제 오링 온도는 그날 밤 논의된 기온보다도 더 낮은 화씨 28도(약 섭씨 영하 2도) 수준이었던 것으로 추정되었습니다.",
    "long_term": "우주왕복선 프로그램은 약 3년간 중단되었다가 1988년에야 재개되었습니다. 나사는 부스터 이음매 설계를 바꾸고 안전 감독 체계를 재정비했습니다. 이 사건은 이후 조직의 의사결정을 연구하는 대표적 사례가 되었고, 사회학자 다이앤 본은 이를 '일탈의 정상화'라는 개념으로, 통계학자 에드워드 터프티는 잘못된 데이터 시각화의 대표 사례로 각각 분석했습니다."
  },
  "hindsight_analysis": "이 사건이 어려운 이유는, 그날 밤 회의실에 있던 사람들이 무능하거나 무관심해서가 아니었다는 데 있습니다. 엔지니어들은 실제로 위험을 감지했고, 목소리를 냈습니다. 문제는 그 감지한 위험을 설득력 있게 전달하는 과정 자체가 무너져 있었다는 점입니다. 그들이 그날 제시한 차트는 손상 정도를 발사 날짜순으로 나열했을 뿐, 정작 핵심 변수인 '온도'를 축으로 삼지 않았습니다. 게다가 손상이 전혀 없었던 따뜻한 날의 발사 기록들은 아예 차트에서 빠져 있었습니다. 결과적으로 온도와 손상의 상관관계는 실제보다 훨씬 약해 보였습니다. 나중에 에드워드 터프티가 같은 데이터를 온도를 가로축, 손상 정도를 세로축에 놓고 다시 그렸을 때는 그 위험이 누가 봐도 명백하게 드러났습니다. 하지만 그것은 사고 이후에 다시 그려진 그래프였습니다. 그날 밤 회의실에 있던 사람들에게는 그런 명확한 그림이 없었습니다. 또 하나 짚어야 할 것은, 그날 밤 '증명의 책임'이 뒤바뀌었다는 점입니다. 보이졸리는 훗날 증언에서, 원래는 '안전하다는 것을 증명해야 발사한다'는 것이 원칙인데, 그 회의에서는 반대로 '안전하지 않다는 것을 명백히 증명하지 못하면 발사한다'는 식으로 기준이 뒤집혔다고 말했습니다. 이 두 가지, 즉 설득력을 잃은 데이터와 뒤바뀐 증명의 책임이 겹치면서, 실제로는 위험 신호가 있었음에도 그것이 결정에 제대로 반영되지 못했습니다. 이 사건을 '신중한 판단이 불운을 만났다'는 식으로 포장하는 것은 정직하지 않습니다. 기록이 보여주는 것은, 판단의 과정 자체에 결함이 있었고, 그 결함이 나쁜 결과로 이어졌다는 것입니다. 이는 이 프로젝트가 다루는 다른 사례들, 즉 '합리적인 결정이었지만 운이 나빴던' 사례들과는 분명히 다른 유형입니다. 판단의 질과 결과의 질이 함께 나빴던 경우도 있다는 것을, 이 사건은 정직하게 보여줍니다.",
  "decision_principle": {
    "plain_language": "숫자와 그래프로 뭔가를 보여주려 할 때, 어떻게 배열하고 무엇을 빼는지에 따라 같은 데이터도 전혀 다른 인상을 줄 수 있습니다. 그리고 '위험하지 않다는 것을 증명하라'는 기준과 '안전하다는 것을 증명하라'는 기준은 얼핏 비슷해 보여도, 불확실한 상황에서는 완전히 다른 결론으로 이어집니다.",
    "tag": "Burden of proof inversion / data presentation failure"
  },
  "longform_story": "1986년 1월 27일 저녁, 미국 유타주에 있는 모튼 티오콜사의 회의실과 앨라배마주 마셜 우주비행센터, 플로리다주 케네디 우주센터를 잇는 전화 회의가 시작되었습니다. 다음 날 아침 발사 예정인 우주왕복선 챌린저호(임무명 STS-51-L)를 두고, 밤늦게까지 이어질 논쟁의 시작이었습니다.\n\n이 순간이 이 이야기의 T0입니다. 아직 아무도 발사 여부를 최종 결정하지 않았고, 다음 날 무슨 일이 벌어질지는 아무도 몰랐습니다. 회의실에 있던 사람들이 그 순간 알고 있던 것은 이랬습니다. 챌린저호는 이미 여러 차례 연기된 끝에 다시 일정이 잡혀 있었습니다. 그리고 그날 밤 기상 예보는 발사장 기온이 지금까지 그 어떤 우주왕복선 발사보다도 낮게 떨어질 것이라 말하고 있었습니다. 밤사이 최저기온은 화씨 22도(섭씨 영하 5~6도) 안팎까지 내려갈 것으로 예상되었고, 발사대에는 이미 얼음이 얼어붙기 시작했습니다.\n\n로켓 부스터의 이음매를 밀폐하는 고무 오링을 설계한 엔지니어 로저 보이졸리와 알란 톰슨에게, 이 예보는 단순한 날씨 정보가 아니었습니다. 정확히 1년 전인 1985년 1월, 당시 기록상 가장 추웠던 발사(화씨 약 53도)에서 오링에 지금까지 본 것 중 가장 심한 손상과 가스 누출 흔적이 나타났던 적이 있었기 때문입니다. 이번 예보대로라면, 그보다 훨씬 더 추운 조건에서 발사하게 되는 셈이었습니다.\n\n보이졸리와 톰슨을 비롯한 티오콜 엔지니어들은 회의에서 화씨 53도 아래에서는 안전을 보장할 데이터가 없다며 발사 연기를 권고했습니다. 이들이 근거로 제시한 자료는 과거 발사들에서 나타난 오링 손상 기록이었습니다. 그런데 이 자료를 정리한 차트에는 결정적인 약점이 있었습니다. 손상 정도를 발사 날짜 순서로 나열했을 뿐, 정작 핵심 변수인 온도를 기준으로 정리하지 않았던 것입니다. 게다가 손상이 전혀 없었던 따뜻한 날의 발사 기록들은 차트에 아예 포함되지 않았습니다. 그 결과, 엔지니어들 자신은 온도와 손상 사이에 뚜렷한 상관관계가 있다고 믿고 있었지만, 정작 그것을 보여주기 위해 준비한 자료는 그 믿음을 설득력 있게 전달하지 못했습니다.\n\n나사 마셜 우주비행센터의 로런스 멀로이와 조지 하디는 이 근거에 강하게 반박했습니다. 이들의 입장에서 볼 때, 제시된 데이터는 단 한 번의 저온 비행 기록에 불과했고, 몇 도 이하가 위험하다는 명확한 기준선도 없었습니다. 게다가 오링에는 하나가 새더라도 두 번째가 버텨주는 이중 구조가 있었고, 지금까지 그 이중 구조가 결정적으로 뚫린 적은 없었습니다. 하디는 이 권고에 '경악했다'고 말했다고 전해집니다.\n\n양측의 대립이 이어지자, 티오콜은 자기들끼리만 따로 논의할 시간을 요청했습니다. 전화 회선을 잠시 끊고 진행된 이 비공개 논의에서, 선임 부사장 제리 메이슨은 기술담당 부사장 로버트 런드에게 '엔지니어의 모자를 벗고 관리자의 모자를 쓰라'고 말했다고 알려져 있습니다. 약 30분 뒤, 티오콜 경영진은 입장을 뒤집었습니다. 발사를 권고하는 최종 문서에는 부사장 조 킬민스터가 서명했고, 끝까지 반대했던 보이졸리와 톰슨은 이 최종 결정 과정에 참여하지 못했습니다.\n\n보이졸리는 훗날 이 순간을 이렇게 증언했습니다. 원래대로라면 '안전하다는 것을 증명해야 발사할 수 있다'는 것이 원칙이어야 하는데, 그날 밤 회의에서는 거꾸로 '안전하지 않다는 것을 의심의 여지 없이 증명하지 못하면 발사한다'는 식으로 기준이 뒤바뀌어 있었다는 것입니다.\n\n자정 무렵, 발사를 승인하는 문서가 나사에 전달되었습니다. 그 문서에는 엔지니어들이 얼마나 강하게, 그리고 끝까지 반대했는지는 충분히 담기지 않았습니다. 나사의 상위 책임자들(레벨 I·II 관계자들)은 이 반대의 실체를 제대로 알지 못한 채 발사를 최종 승인했습니다.\n\n다음 날 아침, 챌린저호는 예정대로 발사되었습니다. 발사 73초 만에, 우주왕복선은 공중에서 분해되었고 탑승했던 승무원 7명 전원이 목숨을 잃었습니다. 이후 조사위원회는 사고 원인을 오른쪽 고체로켓부스터 이음매의 오링 밀폐 실패로 결론지었습니다. 더 나아가, 실제 그날 아침 오링 자체의 온도는 전날 밤 논의됐던 기온보다도 더 낮은, 화씨 약 28도(섭씨 영하 2도 안팎) 수준이었던 것으로 추정되었습니다. 부스터가 밤새 그늘진 쪽에서 그만큼 더 차갑게 식어 있었기 때문입니다. 이 정확한 수치는 그날 밤 회의에 참여한 그 누구도 알 수 없었던 정보였습니다.\n\n이 사건은 종종 '경고를 무시한 관료주의의 비극'으로 단순하게 요약되곤 합니다. 하지만 그 요약은 중요한 부분을 놓칩니다. 문제는 단순히 누군가 경고를 '무시'한 것이 아니라, 경고 자체가 설득력 있는 형태로 전달되지 못했다는 데 있었습니다. 엔지니어들이 믿고 있던 위험은 실재했지만, 그것을 보여주는 자료의 구성 방식이 그 위험을 오히려 흐렸습니다. 훗날 통계학자 에드워드 터프티가 같은 데이터를 온도를 가로축, 손상 정도를 세로축에 두고 다시 그렸을 때는, 온도가 낮아질수록 손상이 커지는 패턴이 누가 봐도 명확하게 드러났습니다. 하지만 그 그래프는 사고 이후에, 사고를 설명하기 위해 다시 그려진 것이었습니다.\n\n판단의 질과 결과의 질을 구분해서 보아야 하는 지점이 바로 여기입니다. 이 사건은 '합리적인 결정이었지만 운이 나빴다'고 말할 수 있는 사례가 아닙니다. 그날 밤의 의사결정 과정에는 실제로 결함이 있었습니다. 위험을 감지하고 목소리를 낸 엔지니어들이 최종 결정에서 배제되었고, 그들이 제시한 근거는 정작 스스로의 확신을 뒷받침하지 못하는 형태로 만들어져 있었고, 안전을 증명해야 할 책임이 슬그머니 반대쪽으로 넘어갔습니다. 이런 결함이 있는 과정에서 나쁜 결과가 나온 것을, 단순한 불운으로 부르기는 어렵습니다.\n\n그렇다면 우리가 가져가야 할 질문은 이것입니다. 만약 당신이 그날 밤 회의실에 있었고, 데이터는 불완전하지만 당신의 직관은 위험을 느끼고 있었다면, 그 직관을 어떻게 숫자로, 그림으로 옮겨 다른 사람을 설득할 수 있었을까요. 그리고 누군가 '지금까지 그런 걸 증명한 사례가 없지 않느냐'고 되물을 때, 당신은 무엇을 근거로 계속 반대할 수 있었을까요."
}
