{
  "case_id": "tetraethyl-lead-1924",
  "hook": "당신 회사가 만드는 첨가제가 자동차 엔진 소음을 크게 줄여줍니다. 문제는, 그것을 만드는 공장 노동자 여러 명이 이미 헛것을 보고 발작을 일으키다 목숨을 잃었다는 것입니다. 그런데 당신 회사 연구원들은 독성이 없는 다른 첨가제도 이미 시험해서 효과를 확인해 두었습니다. 다만 그 대안은 누구나 만들 수 있어서, 특허로 독점할 수도, 그것으로 큰돈을 벌 수도 없습니다. 사람이 이미 죽었다는 것과, 안전한 대안이 이미 있다는 것을 알면서도, 당신이라면 어느 쪽을 계속 만들겠습니까.",
  "short_setup": "1920년대 초, 자동차 엔진의 '노킹' 소음을 없애줄 첨가제로 사에틸납(테트라에틸납)이 개발됩니다. 그런데 이 물질을 만들던 공장 노동자들이 잇따라 심각한 중독 증세를 보이다 사망하는 사건이 여러 공장에서 벌어집니다. 1924년 10월에는 뉴저지의 한 정유공장에서 노동자 여럿이 환각과 발작을 일으키다 목숨을 잃는 일이 벌어집니다. 이 회사(제너럴모터스, 스탠더드오일, 듀폰이 함께 만든 '에틸사')의 연구진은 사실 독성 없는 다른 첨가제, 즉 알코올(에탄올) 혼합 연료도 이미 시험해 효과를 확인해 두고 있었습니다. 다만 알코올은 누구나 만들 수 있어 특허로 독점할 방법이 없었습니다.",
  "why_option_a_made_sense": "회사 입장에서는, 노동자들의 중독 사고는 공장에서 물질을 다루는 과정의 문제이지, 자동차에 아주 소량으로 희석되어 들어가는 최종 제품 자체의 문제는 아니라고 볼 여지가 있었습니다. 실제로 당시 여러 화학 산업에서는 제조 과정의 위험을 보호장비나 작업방식 개선으로 관리하는 것이 흔한 접근이었습니다. 배기가스를 통한 대기 중 노출이 실제로 사람들에게 위험한지는 그 당시 과학적으로 증명되지 않은, 논쟁 중인 주장이었습니다. 반면 이 첨가제는 성능이 뛰어났고, 특허로 보호되어 오직 이 회사만 만들고 팔 수 있는 제품이었습니다.",
  "why_option_b_made_sense": "그러나 이미 여러 공장에서, 이름까지 확인된 노동자들이 실제로 죽었습니다. 이것은 가정이 아니라 이미 벌어진 사실이었습니다. 게다가 예일대의 생리학자 옌들 헨더슨을 비롯한 공중보건 과학자들은, 이 물질이 자동차 배기가스를 통해 도시 전역에 퍼지면 장기적으로 누적된 위험이 될 수 있다고 당시에 이미 공개적으로 경고하고 있었습니다. 마침 회사 자신이 실험해 확인해 둔, 독성이 없는 대체재(알코올 혼합 연료)도 있었습니다. 이미 사람이 죽었고, 안전한 대안이 있다면, 그 대안으로 전환하는 것이 상식적인 선택이었습니다.",
  "actual_decision_explanation": "1924년 10월 사망 사고 이후, 생산은 일시적으로 자발적 중단 상태에 들어갔고, 이 문제는 1925년 5월 20일 워싱턴에서 열린 미국 공중보건국(PHS) 회의로 이어졌습니다. 스탠더드오일의 프랭크 하워드 등 업계 대표들은 회의에서, 실제 자동차 연료에 섞이는 희석 비율로는 위험이 미미하며, 노동자 안전은 작업 절차 개선으로 해결할 수 있다고 주장했습니다. 이 논리를 바탕으로 1926년 1월, 공중보건국 조사위원회는 '금지할 명확한 근거가 없다'는 결론을 내렸고, 사에틸납 생산과 판매는 재개되었습니다.",
  "outcome_story": {
    "immediate": "1926년 조사위원회의 결론 이후 사에틸납 휘발유는 미국 자동차 연료의 표준으로 자리잡았습니다. 노동자 보호 조치가 일부 권고되었지만, 제품 자체의 사용은 계속되었습니다.",
    "long_term": "이후 약 50년 가까이 유연휘발유는 미국의 표준 연료로 쓰였습니다. 1960년대 지구화학자 클레어 패터슨의 연구는, 자동차 배기가스에서 나온 납이 자연적으로 존재하는 양보다 훨씬 많은 납을 환경과 사람 몸속에 축적시켜 왔다는 것을 밝혀냈습니다. 이는 1970년 대기청정법 제정과 1975년 무연휘발유 도입, 1996년 미국 내 자동차용 유연휘발유 전면 금지로 이어졌습니다. 이후 수많은 역학 연구는 특히 어린이의 인지 발달에 납 노출이 끼친 해로운 영향을 보고하고 있습니다."
  },
  "hindsight_analysis": "이 사건을 어렵게 만드는 것은 역설적으로, 겉보기엔 그리 어렵지 않아 보인다는 점입니다. 이미 사람이 죽었고, 안전한 대안이 있었다면, '당연히 중단해야 한다'는 결론이 자연스러워 보입니다. 하지만 그 시대의 논리 안으로 들어가 보면, 이 판단이 실제로는 훨씬 더 복잡했다는 것을 알 수 있습니다. 당시 화학 산업에서 제조 공정 중 노동자가 위험한 물질에 노출되어 다치거나 죽는 사고는, 끔찍하지만 드물지 않은 일이었고, '작업 방식을 개선하면 해결된다'는 논리는 완전히 터무니없는 것은 아니었습니다. 그리고 자동차 배기가스가 도시 전체에 미치는 장기적 영향이라는 개념은, 오늘날처럼 명확한 과학적 근거로 뒷받침되지 않은, 당시로서는 아직 검증되지 않은 가설이었습니다. 실제로 그 가설을 숫자로 증명해낸 것은 그로부터 40년 가까이 지난 1960년대, 지구화학자 클레어 패터슨이 극도로 정밀한 납 동위원소 측정법을 개발한 뒤였습니다. 그렇다면 이 결정을 정말로 '나쁜' 결정으로 만드는 것은 무엇일까요. 그것은 단순히 결과가 나빴다는 사실이 아니라, 그 판단의 근거 안에 상업적 이해관계가 상당히 깊게 얽혀 있었다는 점입니다. 이 회사는 사에틸납 특허를 독점하고 있었고, 안전한 대안이었던 알코올 혼합 연료는 누구나 만들 수 있어 독점할 수 없었습니다. 즉 '노동자 안전은 관리 가능하고 대기 중 위험은 증명되지 않았다'는 주장 뒤에는, '이 제품만이 우리 회사에 돈을 벌어다 준다'는 계산이 함께 있었습니다. 이후 역사학자들의 분석에 따르면, 최종 판정을 내린 공중보건국의 조사 자체도 독립적인 연구 역량이 부족해 업계가 제공한 자료에 상당 부분 의존했습니다. 판단의 질과 결과의 질을 나눠서 보면, 이 사건은 둘 다 나빴던 경우에 가깝습니다. 이미 확인된 사망 사고와 신뢰할 만한 과학자의 경고, 그리고 검증된 대안이 있었음에도, 특허로 보호되는 수익성을 지키는 쪽으로 판단이 기울었습니다. 그리고 그 판단은 실제로 수십 년에 걸친 광범위한 인구집단의 납 노출이라는, 되돌리기 어려운 결과로 이어졌습니다. 이 사건을 '그때는 몰랐으니 어쩔 수 없었다'는 식으로 정리하는 것은 정직하지 않습니다. 몰랐던 것은 정확한 피해의 규모와 메커니즘이었지, 위험 가능성에 대한 경고 자체가 아니었기 때문입니다.",
  "decision_principle": {
    "plain_language": "이미 확인된 피해와 아직 증명되지 않은 위험이 함께 있을 때, 사람과 조직은 종종 '아직 증명되지 않았다'는 말을 '괜찮다'는 뜻으로 바꿔 듣습니다. 특히 그 판단이 자신에게 이익이 되는 방향과 일치할 때는 더욱 그렇습니다.",
    "tag": "Motivated reasoning under commercial interest"
  },
  "longform_story": "1921년 12월, 제너럴모터스 연구소에서 엔지니어 토머스 미즐리는 한 화합물을 자동차 엔진에 시험하고 있었습니다. 사에틸납, 훗날 '테트라에틸납'이라 불리게 될 이 물질을 아주 소량 섞자, 그동안 골칫거리였던 엔진의 '노킹' 소음이 눈에 띄게 줄어들었습니다. 미즐리와 그의 상사 찰스 케터링에게는 반가운 발견이었습니다. 흥미로운 사실은, 미즐리가 그 무렵 알코올(에탄올)을 연료에 섞는 방법도 함께 연구하고 있었다는 점입니다. 알코올 혼합 연료 역시 노킹을 줄이는 효과가 있었고, 독성 문제도 없었습니다. 다만 결정적인 차이가 있었습니다. 사에틸납은 특허로 보호할 수 있어 오직 이 회사만 만들고 팔 수 있었지만, 알코올은 곡물을 발효시켜 누구나 만들 수 있는 물질이어서 독점할 방법이 없었습니다.\n\n이후 몇 년 사이, 사에틸납을 생산하는 공장에서 심상치 않은 사고들이 이어졌습니다. 1923년 9월, 듀폰사의 뉴저지 딥워터 공장에서 프랭크 더르라는 노동자가 납 중독으로 사망했습니다. 같은 공장에서 이후 몇 명이 더 목숨을 잃었습니다. 제너럴모터스의 오하이오주 데이턴 시범 공장에서도 노동자 사망 사고가 있었습니다.\n\n결정적인 사건은 1924년 가을에 벌어졌습니다. 스탠더드오일의 뉴저지 베이웨이 정유공장에서, 9월 말부터 10월 말까지 여섯 명의 노동자가 잇따라 심각한 환각과 발작 증세를 보이다 사망했습니다. 이들 중 일부는 동료들에게 '누가 자신을 쫓아온다'며 소리를 지르다 쓰러졌고, 회사 내부에서는 이 작업 건물을 '미치광이 가스 건물'이라 부를 정도였습니다. 서른 명이 넘는 다른 노동자들도 병원에 실려 갔습니다. 뉴저지주 정부는 그 즉시 이 공장의 사에틸납 생산을 중단시켰습니다.\n\n이 순간이 이 이야기의 T0입니다. 제너럴모터스와 스탠더드오일, 그리고 이들이 함께 만든 '에틸사'는 이제 선택의 기로에 서 있었습니다. 이미 여러 공장에서 이름이 확인된 노동자들이 사망했고, 예일대 생리학자 옌들 헨더슨을 비롯한 과학자들은 이 물질이 자동차 배기가스를 통해 도시 전체에 퍼지면 장기적으로 누적된 위험이 될 수 있다고 공개적으로 경고하고 있었습니다. 그리고 회사 자신의 연구진이 이미 시험해 효과를 확인해 둔, 독성 없는 대안, 즉 알코올 혼합 연료도 있었습니다.\n\n하지만 회사의 입장은 달랐습니다. 공장에서 일어난 사고는 물질을 다루는 과정에서 생긴 산업재해로, 작업 절차를 개선하면 해결할 수 있는 문제라고 보았습니다. 그리고 실제 자동차에 들어가는 사에틸납은 극히 소량으로 희석되기 때문에, 그것이 배기가스를 통해 사람들에게 정말 해를 끼치는지는 아직 증명되지 않았다고 주장했습니다. 초기 언론 대응에서 스탠더드오일 측은 노동자들의 증세가 단순히 과로 때문이라는 취지의 설명을 내놓기도 했는데, 이는 당시 다른 의사들과 보건 전문가들로부터 곧바로 반박을 받았습니다.\n\n이 논쟁은 결국 1925년 5월 20일, 워싱턴에서 열린 미국 공중보건국 회의로 이어졌습니다. 산업 독성학의 선구자인 앨리스 해밀턴을 비롯한 학자들과, 스탠더드오일의 부사장 프랭크 하워드를 비롯한 업계 대표들이 함께 모였습니다. 하워드는 자동차 연료에 섞이는 희석 비율로는 위험이 미미하다고 주장했고, 노동자 안전은 작업 절차 개선으로 관리할 수 있다고 말했습니다. 이 논리는 받아들여졌습니다. 1926년 1월, 공중보건국 조사위원회는 '(제품을) 금지할 명확한 근거가 없다'고 결론지었고, 노동자 보호를 위한 권고와 함께 추가 연구를 제안하는 선에서 마무리했습니다. 사에틸납 생산과 판매는 재개되었습니다.\n\n이후 이 물질이 섞인 '유연휘발유'는 거의 반세기 가까이 미국 자동차 연료의 표준으로 자리잡았습니다.\n\n이 이야기가 훗날 완전히 다른 국면을 맞이한 것은 1960년대였습니다. 지구화학자 클레어 패터슨은 원래 지구의 나이를 측정하기 위해 극도로 정밀한 납 동위원소 측정 기술을 개발하고 있었습니다. 그런데 이 과정에서 그는 이상한 점을 발견했습니다. 실험실 어디를 가나, 심지어 사람의 몸속에서도, 자연적으로 존재해야 할 양보다 훨씬 많은 납이 검출되었던 것입니다. 1965년, 패터슨은 이 초과분의 상당 부분이 자동차 배기가스에서 나온 것이라는 연구 결과를 발표했습니다. 이는 40년 전 옌들 헨더슨이 근거 없는 우려라며 무시당했던 바로 그 경고가, 실제로는 정확했다는 것을 뒤늦게 숫자로 증명한 것이었습니다. 이 연구는 이후 1970년 미국 대기청정법 제정과 1975년 무연휘발유 도입, 1996년 자동차용 유연휘발유 전면 금지로 이어지는 긴 흐름의 출발점이 되었습니다.\n\n이 사건은 흔히 '그때는 몰랐으니 어쩔 수 없었다'는 식으로 이야기되곤 합니다. 하지만 그 서술은 정확하지 않습니다. 그들이 정말 몰랐던 것은 정확한 피해의 규모와 그것을 증명할 과학적 방법이었지, 위험 가능성에 대한 경고 자체가 아니었습니다. 헨더슨과 해밀턴 같은 당대의 과학자들은 이미 그 순간에 목소리를 냈습니다. 다만 그 목소리는, 특허로 보호되는 독점 제품이 가져다주는 수익 앞에서 충분히 무겁게 받아들여지지 않았습니다.\n\n판단의 질과 결과의 질을 나눠서 보면, 이 사건은 둘 다 나빴던 드문 사례입니다. 이미 사람이 죽었고, 신뢰할 만한 경고가 있었고, 검증된 안전한 대안까지 있었음에도, 특허로 보호되는 이익을 지키는 방향으로 판단이 기울었습니다. 그리고 그 판단은 실제로 수십 년에 걸친 광범위한 인구집단의 납 노출이라는, 되돌리기 어려운 결과로 이어졌습니다.\n\n만약 당신이 1924년의 그 회의실에 있었고, 이미 죽은 노동자들의 이름과, 아직 증명되지 않은 장기적 위험에 대한 경고와, 특허로 보호되는 제품이 가져다줄 막대한 수익 사이에 서 있었다면, 무엇을 기준으로 판단했을까요. 그리고 '아직 증명되지 않았다'는 말을, 정말로 '괜찮다'는 뜻으로 받아들일 수 있었을까요."
}
