{
  "case_id": "mawson-far-eastern-party-1912",
  "hook": "당신은 남극 대륙 한복판, 가장 가까운 사람이 있는 곳까지 500킬로미터가 남은 지점에 있습니다. 방금 동료 한 명이 눈에 덮여 보이지 않던 균열 속으로 사라졌습니다. 가장 튼튼한 개들과 식량 대부분, 텐트까지 그와 함께 사라졌습니다. 이제 남은 건 단둘, 열흘 남짓한 식량, 그리고 지친 개 여섯 마리뿐입니다. 돌아갈 길을 정해야 합니다. 한쪽은 해안으로 내려가는 길인데, 그곳 역시 갈라진 얼음투성이지만 물범을 잡아먹을 수 있고 어쩌면 배를 발견할지도 모릅니다. 다른 쪽은 왔던 길을 되짚어 곧장 기지로 향하는 길인데, 추가로 식량을 구할 방법은 없습니다. 방금 동료를 삼킨 것과 같은 얼음 균열이 어느 길에도 숨어 있을 수 있습니다. 당신이라면 어느 쪽을 택하겠습니까?",
  "short_setup": "1912년 12월, 남극 탐험대 '극동 탐사대'는 기지에서 약 500킬로미터 떨어진 지점까지 썰매 탐사를 나갔습니다. 대원 세 명 중 벨그레이브 니니스가 눈에 덮여 보이지 않던 크레바스에 빠져 사라졌고, 가장 좋은 개 여섯 마리와 식량 대부분, 텐트까지 함께 잃었습니다. 남은 두 사람, 더글러스 모슨과 자비에 메르츠는 열흘 남짓한 식량과 지친 개 여섯 마리만으로 500킬로미터를 되돌아가야 했습니다. 이들은 해안으로 내려가는 길과, 왔던 길을 되짚어 곧장 기지로 향하는 길 중 하나를 골라야 했습니다.",
  "why_option_a_made_sense": "해안으로 내려가는 길에는 분명한 이점이 있었습니다. 해안에 닿으면 물범을 사냥해 절박하게 부족한 식량을 보충할 수 있었고, 해안선을 따라 움직이던 다른 탐사대나 구조선을 우연히 만날 가능성도 있었습니다. 단둘이 남은 상황에서, 자신들의 체력과 남은 식량만으로 버티는 것보다 외부의 도움을 기대할 수 있는 경로를 택하는 것은 나름대로 합리적인 계산이었습니다.",
  "why_option_b_made_sense": "그러나 모슨은 해안으로 내려가는 길 자체가 심하게 갈라진 빙하 지대를 통과해야 한다는 것을 알고 있었습니다. 불과 몇 시간 전, 안전해 보이던 눈 위에서 동료가 크레바스에 빠져 목숨을 잃었습니다. 게다가 한여름에 가까워지는 시기, 해안의 바다 얼음이 이동 중에 갈라지거나 녹아내릴 위험도 있었습니다. 반면 고원을 가로질러 곧장 기지로 향하는 길은 어느 정도 익숙한 지형이었고, 별도의 위험한 하강 구간을 거치지 않아도 되는, 더 직접적인 경로였습니다. 모슨은 날씨만 버텨준다면 남은 식량과 개 여섯 마리로 기지까지 갈 수 있을 것이라 판단했습니다.",
  "actual_decision_explanation": "사고 당일인 1912년 12월 14일, 모슨과 메르츠는 함께 이 결정을 내렸습니다. 모슨은 훗날 '얼어붙은 바다로 내려가는 길은 그곳의 빙하가 심하게 갈라져 있어 위험하다는 것이 명백했다'고 기록했습니다. 두 사람은 날씨가 버텨준다면 열흘 남짓한 식량과 남은 개 여섯 마리로 기지까지 갈 수 있으리라 보고, 고원을 가로지르는 경로를 택했습니다. 이들에게는 니니스와 함께 사라진 삽과 얼음도끼도 없었고, 기둥 없는 예비 텐트 천만 남아 있었습니다.",
  "outcome_story": {
    "immediate": "1913년 1월 초부터 메르츠의 건강이 급격히 나빠지기 시작했고, 발작과 혼미 증세를 보이다 1월 8일 사망했습니다. 홀로 남은 모슨은 썰매를 반으로 잘라 최소한의 짐만 꾸린 채 이동을 이어갔습니다. 1월 17일에는 그 자신도 크레바스에 빠졌으나 썰매 하네스 덕분에 간신히 목숨을 건졌고, 이후 밧줄 사다리를 직접 만들어 대비했습니다. 마침내 기지 근처 대피소인 '알라딘의 동굴'에 도달했지만 일주일간 이어진 눈보라에 갇혔고, 1913년 2월 8일에야 본진에 도착했습니다. 그러나 구조선 오로라호는 불과 몇 시간 전에 이미 떠난 뒤였습니다.",
    "long_term": "모슨과, 그를 찾아 나섰다가 함께 남게 된 수색대원 6명은 예정에 없던 두 번째 남극 겨울을 나야 했고, 오로라호는 1913년 12월이 되어서야 이들을 데리러 돌아왔습니다. 모슨은 1915년 이 탐험의 기록을 담은 『눈보라의 고향』을 출간했습니다. 메르츠의 정확한 사인은 오늘날까지도 논쟁거리로 남아 있습니다. 1969년에는 개의 간을 먹어 생긴 비타민A 과다증이라는 가설이 제기되었지만, 2005년의 재평가 연구는 극심한 영양실조와 심리적 충격이 더 큰 원인이었을 가능성을 제기했습니다."
  },
  "hindsight_analysis": "이 사건이 어려운 이유는, 결정 자체가 명백히 잘못되었다고 말하기 어렵기 때문입니다. 동료가 크레바스에 빠져 사라진 직후, 또 다른 크레바스투성이 지대를 자진해서 통과하는 길을 피한 것은 그 순간 가장 눈에 보이는 위험을 피하는, 지극히 자연스러운 판단이었습니다. 실제로 모슨은 그 이후 고원을 가로지르는 '더 안전해 보였던' 길에서조차 자신도 크레바스에 빠지는 경험을 했으니, 어느 쪽 길을 택했든 크레바스라는 위험 자체는 완전히 피할 수 없었을 가능성이 높습니다. 다만 이 선택에는 눈에 잘 띄지 않는 대가가 따랐습니다. 남은 개들, 특히 그 간을 먹는 식단이 메르츠의 죽음과 어떤 관련이 있는지는 지금도 완전히 밝혀지지 않았습니다. 1912년 당시에는 개의 간에 다량 함유된 비타민A가 인체에 어떤 영향을 미치는지 아는 사람이 사실상 없었습니다. 즉 설령 이 식단이 메르츠의 죽음에 영향을 미쳤다 하더라도, 그것은 모슨과 메르츠가 그 순간 알 수 없었던, 예측 불가능한 위험이었습니다. 해안으로 내려가는 길을 택했다면 어떻게 되었을지는 아무도 알 수 없습니다. 물범을 만나 식량을 보충했을 수도, 심하게 갈라진 빙하를 내려가다 크레바스에 빠졌을 수도 있습니다. 이 사건에서 결정의 질과 결과의 질을 나누어 보면, 결정 자체는 방금 목격한 위험을 반복하지 않으려 한, 나름대로 신중한 판단이었다고 평가할 수 있습니다. 하지만 그 결정이 만들어낸 결과는 뒤섞여 있습니다. 모슨은 결국 살아 돌아왔지만, 메르츠는 죽었고, 모슨 자신도 자신의 크레바스 낙상과 며칠 차이로 배를 놓치는, 아슬아슬한 생존이었습니다. 이 사건이 남기는 질문은 '어느 길이 옳았는가'가 아니라, 눈앞의 위험을 피하기 위해 내린 결정이, 당장은 보이지 않는 다른 위험(이 경우, 대체 식량이 없는 식단)을 얼마나 정직하게 함께 저울질할 수 있는가 하는 것입니다.",
  "decision_principle": {
    "plain_language": "사람은 방금 눈앞에서 벌어진 위험은 강하게 피하려 하지만, 그 대신 선택한 길에 숨어 있는, 당장 눈에 보이지 않는 위험은 상대적으로 가볍게 여기는 경향이 있습니다. 특히 극한 상황에서는 '방금 나를 위협한 것과 같은 위험'을 다시 마주하지 않는 것이 최우선 목표가 되기 쉽습니다.",
    "tag": "최근성 편향 (recency bias) / 눈에 보이는 위험 회피"
  },
  "longform_story": "1912년 12월 14일, 남극 대륙 킹 조지 5세 랜드의 눈 덮인 고원 위에서, 더글러스 모슨이 이끄는 세 사람의 썰매 탐사대는 기지에서 이미 500킬로미터 가까이 떨어진 지점을 지나고 있었습니다. 이들은 오스트레일리아 남극 탐험대 소속 '극동 탐사대'로, 기지에서 동쪽으로 최대한 멀리 나아가 지도를 만드는 임무를 맡고 있었습니다.\n\n대원 벨그레이브 니니스는 앞장서 썰매를 끌고 있었습니다. 겉보기에 단단해 보이던 눈 표면 아래에는, 눈에 덮여 전혀 보이지 않던 깊은 크레바스가 숨어 있었습니다. 니니스와 그의 썰매, 그리고 가장 튼튼한 개 여섯 마리가 그 속으로 사라졌습니다. 모슨과 남은 대원 자비에 메르츠는 세 시간 넘게 크레바스 아래를 향해 소리쳤지만, 아무 대답도 돌아오지 않았습니다. 그들이 가진 밧줄로는 구조는커녕 바닥조차 확인할 수 없었습니다.\n\n이 순간이 이 사건의 T0입니다. 니니스와 함께 텐트, 삽, 얼음도끼, 그리고 식량 대부분이 사라졌습니다. 남은 것은 단둘, 앞으로 열흘 남짓 버틸 수 있는 식량, 그리고 이제는 먹일 식량조차 없는 지친 개 여섯 마리뿐이었습니다. 기지까지는 여전히 약 500킬로미터가 남아 있었습니다.\n\n두 사람 앞에는 두 갈래 길이 있었습니다.\n\n하나는 해안으로 내려가는 길이었습니다. 해안에 닿으면 물범을 사냥해 식량을 보충할 수 있었고, 해안선을 따라 이동하던 다른 탐사대나 구조선을 우연히 만날 가능성도 있었습니다. 단둘만의 힘으로 500킬로미터를 버티는 것보다, 외부의 도움을 기대할 수 있는 경로를 택하는 것은 그 자체로 합리적인 계산이었습니다.\n\n다른 하나는 고원을 가로질러 곧장 기지로 향하는, 왔던 길에 가까운 경로였습니다. 하지만 모슨은 해안으로 내려가는 길 자체가 심하게 갈라진 빙하 지대를 통과해야 한다는 사실을 이미 알고 있었습니다. 불과 몇 시간 전, 안전해 보이던 눈 위에서 동료가 크레바스에 빠져 사라졌습니다. 한여름에 가까워지는 시기라 해안의 바다 얼음이 이동 중에 갈라질 위험도 있었습니다.\n\n모슨은 훗날 이렇게 기록했습니다. '얼어붙은 바다로 내려가는 길은 그곳의 빙하가 심하게 갈라져 있어 위험하다는 것이 명백했다.' 그와 메르츠는 날씨만 버텨준다면, 남은 열흘치 식량과 개 여섯 마리로 고원을 가로질러 기지까지 갈 수 있으리라 판단했습니다. 두 사람은 사고 당일, 왔던 길을 되짚어 가는 쪽을 택했습니다.\n\n이후의 여정은 혹독했습니다. 두 사람은 지친 개들을 한 마리씩 잡아 식량으로 삼으며 나아갔습니다. 개고기는 질기고 냄새가 강해 삶아서 먹는 편이 그나마 나았습니다. 1913년 1월 초부터 메르츠의 몸 상태가 눈에 띄게 나빠지기 시작했습니다. 그는 발작과 혼미 증세를 보이다 1월 8일, 기지로부터 여전히 160킬로미터 가까이 떨어진 곳에서 숨을 거두었습니다.\n\n홀로 남은 모슨은 썰매를 반으로 잘라 최소한의 짐만 남기고 나아갔습니다. 1월 17일에는 그 자신도 크레바스에 빠졌습니다. 다행히 썰매에 연결된 하네스가 그를 붙들어주었고, 그는 이후 밧줄 사다리를 만들어 다시 같은 상황에 대비했습니다. 마침내 기지 근처의 대피소, '알라딘의 동굴'에 다다랐지만 일주일 동안 이어진 눈보라에 갇혀 더 나아가지 못했습니다. 그가 마침내 본진에 도착한 것은 1913년 2월 8일이었습니다. 그러나 그를 태우고 돌아갈 구조선 오로라호는 불과 몇 시간 전에 이미 떠난 뒤였습니다.\n\n모슨과, 그를 찾기 위해 남아 있던 수색대원 6명은 그렇게 예정에 없던 두 번째 남극의 겨울을 나야 했습니다. 오로라호는 1913년 12월이 되어서야 돌아와 이들을 데려갔습니다. 모슨은 1915년, 이 탐험의 전 과정을 담은 『눈보라의 고향』을 펴냈습니다.\n\n오늘날 이 이야기는 흔히 '홀로 살아남은 탐험가의 초인적인 의지'로 단순화되어 전해집니다. 하지만 그 단순화는 이야기의 앞부분, 즉 니니스가 사라진 직후 모슨과 메르츠가 실제로 마주했던 선택의 순간을 지워버립니다. 그 순간 두 사람에게는 해안으로 내려가 물범과 구조의 가능성에 걸어보는 길과, 위험하지만 익숙한 고원을 가로질러 곧장 기지로 향하는 길, 두 가지가 모두 실제로 열려 있었습니다.\n\n결과만 보면 고원 경로를 택한 것이 옳은 선택이었다고 말하고 싶어집니다. 모슨은 결국 살아 돌아왔으니까요. 하지만 그 길에서도 그는 스스로 크레바스에 빠졌고, 메르츠는 목숨을 잃었습니다. 메르츠의 정확한 사인은 지금도 완전히 밝혀지지 않았습니다. 1969년 한 연구는 남은 개들의 간을 먹은 것이 비타민A 과다증을 일으켰다고 보았지만, 2005년의 재평가 연구는 그보다 극심한 영양실조와 니니스를 잃은 심리적 충격, 갑작스러운 육식 위주 식단으로의 전환이 더 큰 원인이었을 가능성을 제기했습니다. 어느 쪽이 맞든, 개의 간에 함유된 비타민A가 인체에 어떤 영향을 미치는지는 1912년 당시 그 누구도 알 수 없었던 지식이었습니다.\n\n반대로 해안 경로를 택했다면 어떻게 되었을지는 누구도 알 수 없습니다. 물범을 만나 여유 있게 식량을 보충했을 수도 있고, 심하게 갈라진 빙하를 내려가다 니니스와 같은 운명을 맞았을 수도 있습니다.\n\n이 지점에서 결정의 질과 결과의 질을 나누어 볼 필요가 있습니다. 모슨과 메르츠의 선택은, 방금 눈앞에서 벌어진 위험을 반복하지 않으려 한, 그 순간으로서는 신중하고 합리적인 판단이었습니다. 하지만 그 결정이 만들어낸 결과는 결코 온전히 좋았다고 말할 수 없습니다. 한 사람은 죽었고, 다른 한 사람은 몇 시간 차이로 배를 놓치는 아슬아슬한 생존을 겪었습니다.\n\n이 사건이 남기는 질문은 '어느 길이 정답이었는가'가 아닙니다. 방금 눈앞에서 벌어진 위험을 피하기 위해 내린 결정이, 당장은 보이지 않는 다른 위험을 얼마나 정직하게 함께 저울질할 수 있었는가 하는 것입니다. 당신이라면, 동료를 삼킨 크레바스를 뒤로하고, 또 다른 크레바스 지대로 자진해서 걸어 들어갈 수 있었겠습니까?"
}
