{
  "case_id": "battle-of-midway-1942",
  "hook": "당신은 항공모함의 함교에 서 있습니다. 정찰기 한 대가 방금 적함을 발견했다는 무전을 보내왔습니다. 그런데 그 안에 항공모함이 있는지는 아직 확실하지 않습니다. 갑판 위 절반의 항공기는 육상 공격용 폭탄을 달고 있고, 나머지는 지금 막 어뢰로 바꿔 달고 있는 중입니다. 지금 있는 대로 바로 띄울 것인가, 아니면 돌아오는 1차 공격대를 착함시키고 무장을 통일해 제대로 된 한 방을 준비할 것인가. 결정을 미루는 한 시간은 적에게도 그대로 주어지는 한 시간입니다.",
  "short_setup": "1942년 6월 4일 아침, 일본 기동부대 기함 아카기의 함교. 미드웨이 섬을 공격한 1차 타격대가 복귀 중이고, 예비 항공기들은 조금 전까지 섬 공격용으로 재무장하라는 명령을 받은 상태였습니다. 그런데 오전 7시 28분, 정찰기가 '적함으로 보이는 배 10척'을 발견했다는 애매한 보고를 보내옵니다. 이후 한 시간 가까이, 그 안에 항공모함이 있는지조차 불분명했습니다. 나구모 주이치 사령관은 지금 있는 항공기로 바로 공격대를 띄울 것인지, 아니면 복귀 중인 항공기를 회수하고 무장을 통일해 제대로 된 연합 공격을 준비할 것인지 결정해야 했습니다.",
  "why_option_a_made_sense": "야마구치 다몬 제독은 지금 뜰 수 있는 항공기로 즉시 공격대를 편성해 띄우자고 건의했습니다. 적 항공모함일 가능성이 있다면, 시간이 무엇보다 중요하다는 논리였습니다. 완벽하게 갖춰진 공격대가 너무 늦게 도착하는 것보다, 다소 어설프더라도 지금 당장 적을 때리는 편이 나을 수 있었습니다. 숙련된 일본 조종사들이라면 교리에서 벗어난 방식으로도 공격을 수행할 수 있다는 자신감도 있었습니다.",
  "why_option_b_made_sense": "나구모 사령관과 참모장 구사카 류노스케 소장은 원칙을 지키는 쪽을 택했습니다. 복귀 중인 1차 공격대는 연료가 부족해 어차피 착함시켜야 했고, 전투기 대부분은 그 호위와 함대 상공 방어에 묶여 있어 즉시 출격에 붙일 호위기가 거의 없었습니다. 게다가 정찰기 보고는 여전히 '~로 보인다'는 수준이었지, 항공모함이 확실히 있다고 확정된 것이 아니었습니다. 일본 해군 항공대의 원칙 자체가, 어설프게 짜인 소수 병력을 방어된 목표에 보내는 것보다 완전히 무장을 통일하고 호위를 갖춘 뒤 한 번에 결정타를 노리는 방식이었습니다.",
  "actual_decision_explanation": "나구모 사령관은 1942년 6월 4일 오전 8시 30분경, 참모장 구사카의 조언에 따라 복귀 중인 미드웨이 공격대를 먼저 착함시키기로 결정했습니다. 이는 즉시 출격 대신 회수와 재무장을 택한 것으로, 오전 10시 30분경을 목표로 통일된 무장과 완전한 호위를 갖춘 연합 공격대를 준비하는 방향이었습니다. 이 결정의 근거는 연료가 부족한 항공기를 어차피 착함시켜야 한다는 점, 즉시 출격에 붙일 호위 전투기가 부족하다는 점, 그리고 적 항공모함의 존재 자체가 아직 확정되지 않았다는 점이었습니다. 다만 어뢰와 폭탄을 바꿔 다는 작업은 손으로 밀고 크랭크로 감아 내리는 대차 몇 대로만 이루어졌기 때문에, 한 번에 소수의 항공기만 재무장할 수 있었고 도중에 되돌리기도 쉽지 않았습니다.",
  "outcome_story": {
    "immediate": "오전 10시 20분에서 26분 사이, 미 해군의 돈틀리스 급강하폭격기들이 아카기, 카가, 소류 세 척을 거의 전투기 엄호가 없는 상태에서 고고도에서 발견해 급강하했습니다. 세 척 모두 불과 몇 분 사이에 화염에 휩싸였습니다. 남은 항공모함 히류는 반격에 나서 미 항공모함 요크타운에 치명타를 입혔지만, 그날 오후 히류 역시 발견되어 격침되었습니다. 일본은 하루 만에 기동부대의 항공모함 네 척을 모두 잃었습니다.",
    "long_term": "숙련된 항공승무원과 정비인력까지 대거 잃으면서, 일본은 전쟁 초반 6개월 수준의 대규모 공세적 항공모함 작전을 다시는 수행할 수 없게 되었습니다. 이 전투는 태평양 해전의 전환점으로 흔히 설명되지만, 그 전환이 얼마나 이 전투 하나에서 비롯된 것인지, 이후 미국의 산업 생산력이나 다른 전투들과 함께 작용한 결과인지는 역사가들 사이에서도 논쟁이 있습니다."
  },
  "hindsight_analysis": "결과만 보면 나구모의 '기다리는 선택'이 일본을 패배로 이끈 결정적 실수처럼 보이기 쉽습니다. 실제로 전후 오랫동안 널리 읽힌 후치다 미쓰오의 회고록은, 미군의 공격이 시작된 바로 그 순간 일본 항공모함 갑판이 무장하고 연료를 채운 항공기로 가득 차 있었다는 극적인 장면을 그렸고, 이 장면은 '그 다섯 분이 전쟁을 갈랐다'는 식의 서사로 굳어졌습니다. 그런데 2005년 파셜과 털리가 일본 측 1차 자료를 새로 분석해 쓴 '셰터드 소드'는 이 장면 자체가 실제 기록과 잘 맞지 않는다고 지적합니다. 특히 아카기의 경우, 10시 20분 시점에 갑판 위에 실제로 대기 중이던 공격기는 거의 없었을 가능성이 크다는 것입니다.\n\n더 중요한 점은, 나구모가 그 순간 알 수 없었던 것들입니다. 첫째, 그가 상대한 것은 항공모함 한두 척이 아니라 엔터프라이즈, 호넷, 요크타운 세 척이었습니다. 요크타운은 한 달 전 산호해 해전에서 큰 손상을 입고 침몰한 것으로 일본 측이 판단했던 함선이었는데, 진주만에서 사흘 만에 응급 수리를 받고 다시 출격한 상태였습니다. 둘째, 미 해군의 급강하폭격기들은 나구모가 무엇을 결정하든 상관없이 이미 공중에 떠서 기동부대를 찾고 있었습니다. 이들이 실제로 기동부대를 발견하게 된 경로는, 매클러스키 소령이 예상 지점에서 적을 찾지 못하고도 계속 수색을 이어가다 우연히 일본 구축함 아라시의 항적을 발견해 뒤쫓은 결과였습니다. 이는 나구모의 판단과는 별개로 미군 쪽에서 일어난 독립적인 사건이었습니다.\n\n이 지점에서 판단의 질과 결과의 질을 나눠서 볼 필요가 있습니다. 나구모의 결정 자체는 당시 일본 해군의 표준 교리, 즉 '어설프게 짜인 소수 병력보다 완전한 한 방'이라는 원칙을 그대로 따른 것이었고, 연료가 부족한 항공기를 착함시켜야 한다는 물리적 제약과, 호위 전투기가 부족하다는 현실적 제약, 그리고 적함 정보가 아직 확정되지 않았다는 정보의 한계 속에서 내려진 것이었습니다. 즉 '합리적' 판단으로 볼 여지가 충분합니다. 하지만 그 결과는 참혹했습니다. 셰터드 소드는 이 간극을 '나구모 한 사람의 망설임이 일본을 패망으로 이끌었다'는 식으로 단순화하지 말라고 경고합니다. 오히려 문제는 그날 아침 내내 반복된 경직된 교리 운영 전체에 있었고, 미군의 성공에는 상당 부분 우연과 미군 측의 독립적인 판단이 겹쳐 있었다는 것입니다. 그렇다고 해서 나구모의 결정이 아무 영향도 없었다고 단정할 수도 없습니다. 이 결정이 결과에 얼마나 직접적인 원인이었는지는, 역사가들 사이에서도 여전히 논쟁적인 문제로 남아 있습니다.",
  "decision_principle": {
    "plain_language": "압도적인 화력을 가진 쪽일수록, '지금 당장 불완전하게 치는 것'보다 '조금 기다려서 완벽하게 치는 것'에 끌리기 쉽습니다. 그런데 그 완벽을 준비하는 시간 동안, 상대는 이쪽이 무엇을 하는지와 상관없이 이미 움직이고 있을 수 있습니다. 원칙을 지키는 선택이 항상 안전한 선택은 아닙니다.",
    "tag": "Coordination vs. speed trade-off"
  },
  "longform_story": "1942년 6월 4일 오전, 태평양 한가운데 떠 있던 일본 항공모함 아카기의 함교는 분주했습니다. 새벽에 띄운 1차 공격대가 미드웨이 섬의 활주로와 시설을 두들기고 돌아오는 중이었고, 조종사들의 무전 보고에는 '한 번 더 때려야 한다'는 내용이 담겨 있었습니다. 이 보고를 받은 나구모 주이치 사령관은 오전 7시 15분, 만약을 대비해 어뢰와 철갑탄으로 무장하고 있던 예비 공격기들을 육상 공격용 폭탄으로 바꿔 달라고 명령했습니다. 이 시점에는 아직 근처에 미군 함대가 있다는 어떤 보고도 없었습니다.\n\n바로 이 순간이 이 사건의 T0입니다. 무장 교체 명령이 막 떨어진 지 13분 뒤, 상황이 바뀝니다.\n\n오전 7시 28분, 순양함 도네에서 발진한 정찰기 한 대가 무전을 보내왔습니다. '적함으로 보이는 배 열 척 발견, 함종 미상.' 미드웨이에서 약 240해리 떨어진 지점이었습니다. 나구모로서는 곤란한 소식이었지만, 아직 결정적인 것은 아니었습니다. 오전 8시 9분, 같은 정찰기는 함종을 순양함과 구축함으로 정정해 보고했습니다. 항공모함이라면 대응이 완전히 달라져야 했지만, 순양함과 구축함이라면 굳이 지금 당장 예비 공격기를 다시 돌릴 필요는 없어 보였습니다.\n\n그런데 오전 8시 20분, 같은 정찰기가 다시 무전을 보냅니다. '적 함대 후방에 항공모함으로 보이는 함정 동반.' '~으로 보인다'는 표현이 붙어 있었지만, 이 한 줄이 나구모에게는 결코 가볍지 않았습니다.\n\n나구모가 이 순간 실제로 손에 쥐고 있던 패는 이랬습니다. 예비 공격기 중 일부는 이미 육상 공격용 폭탄으로 무장을 바꾼 상태였고, 나머지는 여전히 어뢰를 달고 있거나 교체 작업 중이었습니다. 어뢰나 폭탄을 옮기는 작업은 사람이 직접 크랭크를 돌려 대차에 싣고 내리는 방식이었기 때문에, 한 항공모함에 대차가 몇 대 되지 않아 한 번에 소수의 항공기만 재무장할 수 있었고, 작업 도중에 되돌리기도 쉽지 않았습니다. 게다가 새벽에 띄운 1차 공격대가 연료 부족 상태로 복귀하고 있었고, 가용 전투기 대부분은 이들의 호위와 함대 상공 방어에 묶여 있었습니다. 즉시 출격할 공격대에 붙일 호위 전투기가 거의 없었던 셈입니다.\n\n이 상황에서 히류를 지휘하던 야마구치 다몬 제독은 다른 의견을 냈습니다. 지금 뜰 수 있는 항공기로 바로 공격대를 편성해 띄우자는 것이었습니다. 적 항공모함일 가능성이 있다면 시간이 무엇보다 중요하고, 다소 어설픈 공격이라도 지금 하는 편이, 완벽하지만 너무 늦게 도착하는 공격보다 나을 수 있다는 논리였습니다.\n\n반면 나구모와 참모장 구사카 류노스케 소장은 원칙을 지키기로 했습니다. 복귀 중인 항공기는 연료 문제로 어차피 착함시켜야 했고, 호위 전투기도 부족했으며, 무엇보다 적 항공모함의 존재 자체가 아직 확정된 것이 아니었습니다. 일본 해군 항공대의 표준 교리는, 어설프게 짜인 소수 병력을 방어된 목표에 보내느니, 무장을 통일하고 호위를 완전히 갖춘 뒤 한 번에 결정타를 노리는 쪽이었습니다.\n\n오전 8시 30분경, 나구모는 복귀 중인 미드웨이 공격대를 먼저 착함시키기로 결정했습니다. 즉시 출격 대신 회수와 재무장을 택한 것입니다. 목표는 오전 10시 30분경까지 통일된 무장과 완전한 호위를 갖춘 연합 공격대를 준비하는 것이었습니다.\n\n하지만 그 시간은 오지 않았습니다. 오전 10시 20분경, 미 해군의 급강하폭격기 편대가 나타났습니다. 이들은 사실 나구모의 결정과는 무관하게 이미 몇 시간 전부터 공중에 떠서 일본 기동부대를 찾고 있던 부대였습니다. 처음에는 예상 지점에서 아무것도 발견하지 못했지만, 지휘관 매클러스키 소령이 수색을 포기하지 않고 계속 비행하다가 우연히 일본 구축함 아라시의 항적을 발견해 그 방향을 따라간 끝에 기동부대를 찾아낸 것이었습니다. 거의 전투기 엄호가 없는 상태에서, 이들은 아카기, 카가, 소류 세 척을 향해 급강하했습니다. 세 척 모두 불과 몇 분 사이에 화염에 휩싸였습니다. 남은 히류는 반격에 나서 미 항공모함 요크타운에 치명타를 입혔지만, 그날 오후 결국 발견되어 격침되었습니다. 일본은 단 하루 만에 기동부대의 항공모함 네 척과 숙련된 항공승무원 다수를 잃었습니다.\n\n전후, 이 전투는 오랫동안 극적인 전설로 다시 쓰였습니다. 당시 아카기에 타고 있던 항공참모 후치다 미쓰오가 1955년에 낸 회고록은, 미군의 공격이 시작된 바로 그 순간 갑판 위가 무장하고 연료를 채운 항공기로 가득했다는 장면을 생생하게 그렸습니다. 이 장면은 이후 오랫동안 '나구모의 다섯 분간의 망설임이 전쟁을 갈랐다'는 서사로 굳어졌습니다.\n\n그런데 2005년, 파셜과 털리가 일본 측 행동보고서와 피해기록을 새로 분석해 펴낸 '셰터드 소드'는 이 장면 자체가 실제 기록과 잘 맞지 않는다고 지적합니다. 특히 아카기의 경우, 공격이 시작된 시점에 갑판 위에 실제로 대기 중이던 공격기는 거의 없었을 가능성이 크다는 것입니다. 더 나아가 이 책은, 문제의 본질을 나구모 한 사람의 순간적 판단이 아니라 그날 아침 내내 반복된 일본 해군의 경직된 작전 교리 전체에서 찾아야 한다고 주장합니다.\n\n다시 T0의 시점으로 돌아가 봅시다. 나구모가 오전 7시 28분부터 8시 30분 사이에 알 수 있었던 것은, 애매한 적함 보고와 부족한 호위 전투기, 그리고 재무장 중인 항공기들뿐이었습니다. 그가 몰랐던 것은, 상대가 항공모함 한두 척이 아니라 세 척이었다는 사실, 그리고 그중 요크타운은 일본이 이미 격침했다고 믿었던 함선이 사흘 만에 응급 수리를 받고 다시 나타난 것이라는 사실이었습니다. 무엇보다 그가 알 수 없었던 것은, 미군의 급강하폭격기들이 이미 공중에 떠서 그의 함대를 찾고 있었으며, 그들이 함대를 발견하게 되는 경로 자체가 나구모의 결정과는 무관한, 미군 쪽의 독립적인 판단(수색을 포기하지 않은 것, 구축함의 항적을 우연히 발견한 것)에서 비롯되었다는 사실이었습니다.\n\n이 지점에서 판단의 질과 결과의 질은 갈라집니다. 나구모의 결정은 당시 확보 가능한 정보와 물리적 제약 안에서, 표준 교리를 따른 합리적인 선택으로 볼 여지가 충분합니다. 반면 그 결과는 일본 해군 역사상 가장 참혹한 하루로 남았습니다. 이 간극을 '망설인 나구모가 일본을 패망시켰다'는 한 문장으로 정리해버리면, 정작 더 중요한 질문을 놓치게 됩니다. 만약 당신이 그 함교에 서 있었고, 부족한 정보와 부족한 호위 전투기, 그리고 손으로 하나하나 옮겨야 하는 어뢰 사이에서 결정을 내려야 했다면, 원칙을 지켰을까요, 아니면 지금 뜰 수 있는 것만으로 도박을 걸었을까요. 그리고 그 선택이 결과를 얼마나 바꿀 수 있었을지, 우리는 여전히 확신할 수 없습니다."
}
