{
  "case_id": "molotov-ribbentrop-1939",
  "hook": "당신은 한 나라의 최고 지도자입니다. 서쪽의 강력한 이웃 나라가 곧 다른 나라를 침공할 준비를 하고 있고, 그 전쟁이 끝나면 다음 차례가 당신 나라일 수도 있습니다. 이를 막으려고 두 강대국과 몇 달째 군사동맹을 협상 중이지만, 상대 대표단은 자기 정부를 대신해 아무것도 결정할 권한이 없고, 정작 국경을 맞댄 나라는 당신의 군대가 자국 영토를 지나가는 것조차 끝내 허락하지 않습니다. 그런데 바로 그 침공을 준비 중인 나라가 갑자기 손을 내밉니다. 서로 공격하지 않기로 하고, 그 대가로 동유럽 일부를 당신의 영향권으로 인정하겠다는 것입니다. 게다가 당신은 이미 동쪽 국경에서 다른 나라와 선전포고 없는 전쟁을 치르는 중입니다. 두 개의 전선에서 동시에 싸울 여유는 없습니다. 지금 당신이라면, 어느 쪽 손을 잡겠습니까?",
  "short_setup": "1939년 8월, 소련은 두 개의 외교 트랙을 동시에 굴리고 있었습니다. 하나는 영국·프랑스와의 3국 군사동맹 협상으로, 모스크바에서 몇 주째 이어지고 있었지만 폴란드와 루마니아가 소련군의 자국 영토 통과를 끝내 거부하면서 사실상 막다른 길에 몰려 있었습니다. 다른 하나는 독일이 은밀히 제안해온 불가침조약으로, 동유럽을 세력권으로 나누는 비밀 의정서까지 포함하고 있었습니다. 같은 시기 소련은 극동 국경에서 일본과 할힌골(노몬한)에서 대규모 무력 충돌을 벌이는 중이었습니다. 두 개의 전선을 동시에 감당할 여유가 없는 상황에서, 스탈린과 정치국은 선택해야 했습니다.",
  "why_option_a_made_sense": "3국 동맹 협상은 8월 14일 보로실로프가 던진 질문 하나에서 사실상 멈춰 있었습니다. '독일과 싸우게 되면, 폴란드와 루마니아는 소련군이 자국 영토를 지나가도록 허락하겠는가?' 영국과 프랑스 대표단은 이 질문에 답할 권한도, 답을 받아올 능력도 없었습니다. 폴란드는 소련군이 일단 들어오면 다시 나가지 않을 것을 우려해 끝내 거부했습니다. 게다가 영국·프랑스 대표단은 정식 전권도 없이 낡은 상선을 타고 느릿느릿 모스크바에 도착한 터라, 소련 쪽에서는 이 협상 자체가 얼마나 절박하게 받아들여지고 있는지 의심할 수밖에 없었습니다. 반면 독일의 제안은 구체적이었습니다. 불가침, 그리고 동유럽 일부에 대한 세력권 인정. 시한이 있고, 내용이 있고, 상대는 실제로 결정을 내릴 수 있는 사람이었습니다. 게다가 소련은 이미 극동에서 일본과 실질적인 전쟁을 치르고 있었습니다. 서쪽에서 또 다른 전선이 열리는 것을 피할 수 있다면, 그것만으로도 상당한 전략적 가치가 있었습니다.",
  "why_option_b_made_sense": "반대로 협상을 포기하지 않고 계속 밀어붙이는 쪽에도 나름의 논리가 있었습니다. 만약 3국 군사동맹이 실제로 성사된다면, 그것은 독일에게 진짜 양면 전쟁의 위협을 안겨줄 수 있는, 원칙적으로는 더 강력한 억지력이었습니다. 소련이 그동안 유지해온 반파시즘·집단안보 노선과도 일치했고, 폴란드와 발트 국가들의 운명을 나누는 일에 공범이 되지 않아도 되는 길이었습니다. 협상이 당장 막혀 있다고 해서 영원히 막혀 있으리라는 보장은 없었고, 폴란드의 입장이 국제적 압력 속에서 바뀔 가능성도 완전히 배제할 수는 없었습니다. 무엇보다, 독일과 손을 잡는다는 것은 히틀러라는, 이념적으로도 적대적인 상대의 말을 그대로 믿어야 한다는 뜻이었습니다. 그 신뢰에는 아무런 검증 장치가 없었습니다.",
  "actual_decision_explanation": "소련은 8월 19일에서 21일 사이 독일 측에 협상을 진행하겠다는 뜻을 전했고, 리벤트로프가 모스크바로 날아와 8월 23일 밤 몰로토프와 조약에 서명했습니다. 이는 3국 군사위원회의 마지막 회의가 열린 8월 21일로부터 불과 이틀 뒤였습니다. 소련 협상단은 폴란드·루마니아 통과 문제가 해결되지 않는 한 군사협정은 불가능하다는 입장을 8월 중순 이래 일관되게 밝혀왔고, 실제로 그 문제는 끝내 풀리지 않았습니다. 조약이 서명된 바로 그날, 모스크바 주재 프랑스 대사는 워싱턴에 '폴란드의 계속된 거부로 영불소 협정은 불가능해졌으며, 설령 폴란드가 뒤늦게 입장을 바꾸더라도 이미 늦었을 것'이라는 취지의 전문을 보냈습니다. 이 결정은 영국·프랑스와의 협상이 여전히 형식적으로 진행 중이던 상황에서 비밀리에 내려졌고, 세력권을 나누는 의정서 내용은 철저히 비공개로 유지해야 했습니다.",
  "outcome_story": {
    "immediate": "독일은 9월 1일 소련의 반대를 걱정할 필요 없이 폴란드를 침공했습니다. 소련 역시 비밀 의정서에 따라 9월 17일 폴란드 동부로 진주했습니다. 일본 정부는 이 조약 소식에 큰 충격을 받았고, 이는 할힌골에서의 정전 협상을 앞당기는 정치적 압력으로 작용했습니다.",
    "long_term": "이후 22개월 동안 소련은 비밀 의정서의 세력권 구도에 대체로 부합하게 발트 3국과 베사라비아를 병합하고 핀란드와 겨울전쟁을 치렀습니다. 그러나 1941년 6월 22일, 독일은 조약을 깨고 소련을 침공했습니다. 소련군은 개전 초기 심각한 궤멸적 손실을 입었습니다. 조약과 비밀 의정서의 존재는 1989년까지 소련 정부에 의해 공식적으로 부인되었습니다."
  },
  "hindsight_analysis": "이 사건이 어려운 것은, 1939년 8월의 정보만 놓고 보면 독일과의 협정이 딱히 무모한 도박처럼 보이지 않는다는 데 있습니다. 영불과의 협상은 말로만이 아니라 실제로 막혀 있었습니다. 보로실로프가 던진 통과권 질문에 폴란드는 끝내 답하지 않았고, 영불 대표단은 그 답을 받아올 능력조차 없었습니다. 반면 독일은 구체적인 안을 들고 왔고, 소련은 이미 극동에서 실제 전쟁을 치르는 중이었습니다. '두 전선에서 동시에 싸우지 않는다'는 것은 당시 기준으로 합리적인 군사적 목표였습니다. 결과만 보고 '스탈린이 히틀러를 믿은 것이 어리석었다'고 말하는 것은, 협정 자체가 안겨준 22개월이라는 시간을 무시하는 평가입니다. 반대로 결과만 보고 '탁월한 선택이었다'고 말하는 것도, 1941년 6월 22일 소련군이 그토록 무방비 상태로 당한 이유를 가려버립니다. 여기서 결정의 질과 결과의 질은 분리해서 봐야 합니다. 1939년 8월 시점에서 이 결정은, 실제로 존재했던 두 선택지 중 더 확실하고 더 구체적인 쪽을 고른, 나름대로 합리적인 계산이었습니다. 하지만 그렇게 벌어들인 시간을 실제 방어 태세 강화에 쓰지 못하고, 1941년 봄까지 이어진 수많은 침공 경고를 스탈린 개인이 거듭 무시한 것은 별개의 실패였습니다. 즉 1939년의 판단과 1941년의 판단은 같은 사람이 내렸지만, 하나로 묶어 평가할 수 없는 서로 다른 결정입니다. 이 사건이 남기는 질문은 '협정이 옳았는가 틀렸는가'가 아니라, '벌어들인 시간을 무엇을 위해 썼는가'입니다.",
  "decision_principle": {
    "plain_language": "지금 당장 확실하게 잡을 수 있는 나쁘지 않은 카드와, 이론적으로는 더 낫지만 실현될지 알 수 없는 카드 사이에서 선택해야 할 때, 사람은 흔히 확실히 손에 쥘 수 있는 쪽을 고릅니다. 문제는 그렇게 벌어들인 여유를 실제로 무엇에 쓰느냐이며, 좋은 선택도 그 이후의 안이함으로 무의미해질 수 있습니다.",
    "tag": "확실성 효과 / 벌어들인 시간의 활용 실패"
  },
  "longform_story": "1939년 8월, 모스크바의 한 회의실에서는 낡은 상선을 타고 도착한 영국과 프랑스의 군사 대표단이 소련의 국방인민위원 클리멘트 보로실로프와 마주 앉아 있었습니다. 협상은 이미 몇 주째 이어지고 있었지만, 정작 이 대표단에게는 자기 정부를 대신해 무언가를 최종 결정할 권한이 없었습니다. 영국 대표단은 정식 전권조차 갖추지 못한 채 협상장에 나왔고, 이동 수단조차 항공편이 아니라 시속 13노트로 움직이는 낡은 화물선이었습니다. 소련 쪽에서 보기에, 이는 상대가 이 협상을 얼마나 진지하게 여기는지에 대한 하나의 신호였습니다.\n\n이 순간이 이 사건의 T0입니다. 아직 어느 쪽으로도 결정이 내려지지 않았고, 두 개의 협상 트랙이 동시에 살아 있었습니다.\n\n8월 14일, 보로실로프는 핵심 질문을 던졌습니다. 독일과 전쟁이 벌어지면, 폴란드와 루마니아는 소련군이 자국 영토를 지나가도록 허락하겠는가. 이는 지리적으로 불가피한 질문이었습니다. 소련과 독일 사이에는 국경이 맞닿아 있지 않았고, 소련군이 독일군과 싸우려면 반드시 폴란드나 루마니아 영토를 통과해야 했습니다. 그러나 영국과 프랑스 대표단은 이 질문에 답할 수 없었습니다. 폴란드 정부는 소련군이 일단 자국 영토에 들어오면 다시 나가지 않을 것을 우려해 끝내 통과를 허락하지 않았습니다. 보로실로프는 이 답이 없이는 '군사협정을 맺기 위한 모든 노력이 실패로 돌아갈 수밖에 없다'고 밝혔고, 이 입장은 8월 21일 마지막 3국 군사위원회 회의까지 바뀌지 않았습니다.\n\n같은 시기, 소련은 이미 다른 전쟁을 치르고 있었습니다. 5월부터 몽골과 만주 국경의 할힌골(노몬한)에서 일본군과 대규모 무력 충돌이 벌어지고 있었고, 8월 20일에는 게오르기 주코프가 이끄는 소련군의 결정적인 공세가 시작되고 있었습니다. 서쪽에서 독일과, 동쪽에서 일본과 동시에 싸우는 상황은 소련이 가장 피하고 싶은 시나리오였습니다.\n\n바로 이 무렵, 독일이 손을 내밀었습니다. 8월 19일에는 소련에 2억 라이히스마르크 규모의 통상 신용을 제공하는 무역협정이 먼저 체결되었고, 이는 정치적 협상의 서곡이었습니다. 뒤이어 독일은 불가침조약과, 동유럽을 세력권으로 나누는 비밀 의정서를 제안했습니다. 핀란드, 에스토니아, 라트비아, 폴란드 동부, 베사라비아를 소련의 세력권으로 인정하겠다는 내용이었습니다.\n\n두 선택지 모두 나름의 근거가 있었습니다. 영불과의 동맹이 실제로 성사된다면, 이는 원칙적으로 독일에게 더 강력한 억지력이 될 수 있었고, 소련이 그동안 쌓아온 반파시즘 외교 노선과도 맞아떨어졌습니다. 반면 독일과의 협정은 구체적이고, 시한이 있고, 상대가 실제로 결정을 내릴 수 있는 위치에 있었습니다. 무엇보다 이미 진행 중인 협상이 폴란드라는, 소련이 통제할 수 없는 제3자의 거부로 막혀 있다는 사실은 바꿀 수 없었습니다.\n\n8월 19일에서 21일 사이, 소련은 독일 측에 협상을 진행하겠다는 뜻을 전달했습니다. 리벤트로프는 서둘러 모스크바로 날아왔고, 8월 23일 밤 몰로토프와 조약에 서명했습니다. 3국 군사위원회의 마지막 회의가 끝난 지 불과 이틀 뒤였습니다. 그날 모스크바 주재 프랑스 대사는 워싱턴에 이렇게 보고했습니다. 폴란드의 계속된 거부로 영불소 협정은 이미 불가능해졌으며, 설령 폴란드가 지금 입장을 바꾸더라도 이미 너무 늦었을 것이라고.\n\n일주일 뒤인 9월 1일, 독일은 폴란드를 침공했습니다. 소련은 반대할 이유가 없었습니다. 9월 17일에는 소련군도 비밀 의정서에 따라 폴란드 동부로 진주했습니다. 흥미롭게도, 이 조약 소식은 일본 정부에도 충격을 안겼습니다. 방공협정의 파트너였던 독일이 등 뒤에서 소련과 손을 잡았다는 사실은 도쿄의 정치적 셈법을 흔들었고, 할힌골에서의 정전 협상이 앞당겨지는 데도 영향을 미쳤습니다.\n\n오늘날 이 조약은 흔히 '스탈린과 히틀러가 손을 잡은 배신의 순간'으로 단순화되어 전해집니다. 하지만 그 단순화는 협상 테이블에 실제로 놓여 있던 다른 선택지, 즉 영불과의 동맹이 이미 폴란드의 거부로 막다른 길에 있었다는 사실을 지워버립니다. 1939년 8월의 시점으로 돌아가 보면, 소련 지도부가 가진 정보 안에서 독일과의 협정은 두 전선 전쟁을 피하고 구체적인 완충지대를 확보할 수 있는, 실현 가능한 유일한 선택지처럼 보였습니다.\n\n그렇다면 이 결정은 '옳았다'고 할 수 있을까요. 좁은 의미에서는 그렇습니다. 조약은 약속한 것을 지켰습니다. 소련은 22개월 동안 독일과의 전쟁을 피했고, 의정서대로 영토적 완충지대를 확보했습니다. 그러나 그 22개월 동안 소련이 한 일은 다가올 전쟁에 대비하는 것이 아니었습니다. 1941년 봄까지 여러 경로로 독일의 침공 가능성을 알리는 정보가 쌓였지만, 스탈린은 이를 거듭 무시했습니다. 1941년 6월 22일, 독일이 조약을 깨고 침공했을 때 소련군은 사실상 무방비 상태였습니다.\n\n여기서 결정의 질과 결과의 질을 나누어 볼 필요가 있습니다. 1939년 8월의 결정 자체는, 그 시점에 실제로 존재했던 정보와 제약 안에서 REASONABLE, 즉 합리적인 계산이었다고 평가할 수 있습니다. 완전히 무결하다고 하기는 어렵습니다. 검증할 수 없는 상대의 약속에 전적으로 의존했다는 점, 그리고 폴란드와 발트 국가들의 운명을 나누는 데 동참했다는 도덕적·전략적 비용은 분명히 그 결정이 안고 간 몫이었습니다. 반면 그 결정이 만들어낸 최종 결과는 MIXED, 즉 뒤섞여 있습니다. 시간은 벌었지만, 그 시간을 준비에 쓰지 못한 것은 같은 사람의 다른 실패였습니다.\n\n이 사건이 우리에게 남기는 질문은 이렇습니다. 만약 당신이 그 자리에서, 확실치 않은 동맹과 구체적이지만 신뢰할 수 없는 협정 사이에서 골라야 했다면 무엇을 선택했겠습니까. 그리고 설령 옳은 선택을 했다 하더라도, 그렇게 벌어들인 시간을 당신은 무엇을 위해 쓰겠습니까."
}
