{
  "case_id": "d-day-launch-1944",
  "hook": "15만 명이 이미 배에 올라탔습니다. 바다는 여전히 거칩니다. 기상 담당자는 내일 아침, 아주 잠깐, 날씨가 갤 것 같다고 말합니다. '것 같다'는 말입니다. 지금 출발하면 그 짧은 틈을 탈 수 있습니다. 하지만 예보가 틀리면, 사상 최대의 상륙작전이 바다 위에서 무너질 수도 있습니다. 반대로 지금 멈추면, 다음 기회는 2주 뒤에나 옵니다. 그동안 15만 명은 배 위에서 계속 기다려야 하고, 이 거대한 작전의 비밀은 하루하루 새어나갈 위험이 커집니다.",
  "short_setup": "1944년 6월, 연합군은 노르망디 상륙작전을 위해 사상 최대 규모의 병력과 함정을 영국 해협에 집결시켰습니다. 원래 6월 5일로 예정됐던 상륙은 폭풍 때문에 하루 연기된 상태였습니다. 상륙에는 특정한 조수와 달빛 조건이 필요했고, 이 조건을 만족하는 날은 6월 5일에서 7일, 그리고 놓치면 약 2주 뒤인 6월 19일경까지 다시 오지 않았습니다. 기상 책임자 제임스 스태그 대령은 6월 6일 아침 잠깐 날씨가 갤 것 같다는, 완벽하지는 않지만 가능성 있는 예보를 아이젠하워 사령관에게 전했습니다.",
  "why_option_a_made_sense": "6월 6일 예보를 믿고 출발하는 쪽은, 지금 아니면 다음 기회가 2주 뒤라는 현실적 압박에서 나온 선택이었습니다. 이미 배에 올라탄 15만 명의 병사들은 계속 기다릴수록 체력과 사기가 떨어질 수밖에 없었고, 이 거대한 작전을 계속 숨기는 것도 시간이 지날수록 어려워졌습니다. 게다가 1944년의 기상 예보 기술로는 완벽하게 확실한 예보 자체가 애초에 불가능했습니다. 불확실하더라도 연합군 최고의 기상팀이 내놓은 전문적 판단을 믿고 움직이는 것이, 오지 않을 확실성을 기다리는 것보다 합리적일 수 있었습니다.",
  "why_option_b_made_sense": "다음 조수 조건까지 약 2주를 기다리는 쪽도 충분히 설득력이 있었습니다. 지금 바다는 여전히 거칠었고, 예보는 어디까지나 '갤 것 같다'는 수준이었습니다. 만약 예보가 틀리면, 함포 지원과 공수작전, 상륙정 통제 모두가 흐트러질 수 있었고, 그 대가는 훨씬 더 큰 인명 피해로 돌아올 수 있었습니다. 복잡하고 정교한 다군종 합동작전을 불확실한 날씨 속에 밀어붙이기보다는, 조금 더 확실한 정보를 기다리는 편이 군사적으로 흔히 선택되는 신중한 판단이었습니다.",
  "actual_decision_explanation": "아이젠하워 사령관은 1944년 6월 5일 새벽 4시 15분경, 사우스윅 하우스에서 몽고메리, 램지, 리맬러리 등 주요 지휘관들과 스태그 대령의 최종 예보 보고를 들은 뒤 상륙을 결행하기로 결정했습니다. 그는 결정을 내리기 전 약 30~45초 동안 침묵했다고 스스로 훗날 회고했습니다. 판단의 근거는, 스태그가 제시한 '완벽하지는 않지만 실재하는' 갬 예보와, 계속 지연될 경우 커지는 병력 피로, 보안 유출 위험, 그리고 다가오는 조수 조건 마감이라는 현실적 제약들을 종합한 것이었습니다. 이 결정은 15만 명이 이미 승선해 있는 상태, 그리고 6월 5~7일 또는 약 2주 뒤인 6월 19일경이라는 좁은 선택지 안에서 내려졌습니다.",
  "outcome_story": {
    "immediate": "1944년 6월 6일, 예보대로 날씨가 상륙작전을 수행할 수 있을 만큼 개면서 함포 지원과 공수작전, 상륙작전이 계획대로 진행되었습니다. 독일군은 날씨가 좋지 않을 것이라 예상해 방어 태세가 느슨했고, 일부 지휘관은 자리를 비우기까지 해 연합군은 어느 정도 기습 효과를 거두며 노르망디에 교두보를 확보했습니다.",
    "long_term": "노르망디 교두보 확보는 유럽 서부전선을 여는 계기가 되었고, 동부전선의 소련군 공세 등 다른 요인들과 함께 나치 독일 패망에 기여한 주요 사건 중 하나로 평가받습니다. 한편 6월 19일에는 실제로 강한 폭풍이 영국 해협을 덮쳐, 오마하 해변에 설치된 인공 항만 멀베리 A가 파괴되었고, 이후 연합군은 남은 항만과 해변 직접 하역에 더 의존해야 했습니다."
  },
  "hindsight_analysis": "이 결정이 옳았다는 것은 결과를 알고 나면 명백해 보입니다. 하지만 1944년 6월 5일 새벽, 사우스윅 하우스에 있던 사람들은 몇 가지를 알 수 없었습니다. 우선 그들이 마주한 예보 자체가 완벽한 확신이 아니라 '내일 아침 잠깐 갤 것 같다'는 수준의, 영국과 미국 기상팀 사이에서도 완전히 일치하지 않는 판단이었다는 점입니다. 위성사진도 없고 대서양 한복판의 관측망도 제한적이던 시절, 24~48시간 뒤의 날씨를 확실하게 아는 것은 애초에 불가능했습니다.\n\n더 결정적으로, 그들은 만약 지금 멈추고 다음 조수 조건인 6월 19일경까지 기다렸다면 무슨 일이 벌어졌을지 전혀 알 수 없었습니다. 실제로 6월 19일, 영국 해협에는 수십 년 만의 강한 폭풍이 몰아쳤고, 이 폭풍은 오마하 해변의 인공 항만 멀베리 A를 파괴할 정도로 강력했습니다. 만약 상륙 함대가 그날 바다 위에 있었거나 해변에 발이 묶여 있었다면 어떤 일이 벌어졌을지는, 지금도 확실히 답할 수 없는 가정입니다. 다만 이 사실은, 겉보기에 '더 안전해 보이는 선택'(기다리기)이 실제로는 훨씬 더 위험했을 수도 있다는 점을 보여주는 인상적인 사례입니다.\n\n판단의 질과 결과의 질을 나눠보면, 아이젠하워의 결정은 단순한 도박이 아니었습니다. 그는 전문가의 예보와, 지연이 가져올 구체적이고 이미 잘 알려진 비용(병력 피로, 보안 유출, 조수 조건 마감)을 함께 저울질했고, 실제로 하루 전에는 그 예보에 따라 연기를 결정한 전례도 있었습니다. 즉 그는 날씨가 어떻든 무조건 밀어붙이는 사람이 아니라, 정보에 따라 움직이는 사람이었습니다. 이 점에서 이 결정은 강한 결정(STRONG)으로 평가할 수 있습니다. 그리고 결과 역시 좋았습니다(GOOD). 다만 그 좋은 결과가, 애초에 예보가 옳았기 때문인지, 아니면 만약 예보가 틀렸더라도 어차피 상륙은 어느 정도 성공했을 것인지, 혹은 정말 아슬아슬한 도박이었는지는 오늘날에도 완전히 단정하기 어렵습니다. 확실한 것은, 만약 그가 기다리는 쪽을 택했다면 마주했을 세계선에 대해서는 우리가 뜻밖에도 상당히 구체적인 단서를 갖고 있다는 점, 그리고 그 단서가 '기다림'이 결코 무조건 안전한 선택은 아니었음을 보여준다는 점입니다.",
  "decision_principle": {
    "plain_language": "확실한 정보를 기다리는 것이 언제나 더 안전한 선택처럼 느껴지지만, 기다리는 동안에도 상황은 계속 변하고 있고 그 변화의 방향은 우리가 통제할 수 없습니다. 때로는 '더 안전해 보이는 미룸'이 실제로는 '덜 안전한 도박'일 수 있습니다.",
    "tag": "Illusion of the safer wait"
  },
  "longform_story": "1944년 6월 4일 저녁, 영국 남부 포츠머스 인근의 사우스윅 하우스. 이 저택은 사상 최대 규모의 상륙작전을 지휘할 연합군 최고사령부의 임시 본부가 되어 있었습니다. 원래 이 작전은 6월 5일로 예정되어 있었지만, 바로 그날 아침 몰아친 폭풍 때문에 아이젠하워 사령관은 이미 하루 연기를 결정한 상태였습니다.\n\n이제 다시 결정의 순간이 다가오고 있었습니다. 이날 저녁부터 다음 날 새벽까지 이어진 회의에서, 기상 책임자인 제임스 스태그 대령이 들어와 새로운 예보를 전했습니다. 6월 6일 아침, 아주 짧은 시간이지만 날씨가 상륙작전을 수행할 수 있을 만큼 갤 것이라는 내용이었습니다. 완벽한 날씨는 아니었습니다. 다만 '가능한' 수준이었습니다.\n\n이 순간이 이 사건의 T0입니다. 결정은 아직 내려지지 않았고, 병사들은 이미 배 위에 있었으며, 시간은 계속 흐르고 있었습니다.\n\n당시 알 수 있었던 것들을 정리하면 이렇습니다. 첫째, 이 상륙작전은 특정한 조수와 달빛 조건을 필요로 했습니다. 야간 공수작전과 함포 지원을 위해서는 늦게 뜨는 달이 필요했고, 상륙 시점에는 독일군의 해변 장애물이 드러나는 썰물이 필요했습니다. 이 두 조건을 동시에 만족하는 날은 한 달에 며칠 되지 않았고, 6월에는 5일에서 7일 사이가 그 창이었습니다. 이 창을 놓치면, 다음 조건은 약 2주 뒤인 6월 19일경에나 다시 찾아올 예정이었습니다.\n\n둘째, 이미 15만 명에 가까운 병력이 상륙정과 수송선에 올라탄 상태였습니다. 일부는 이미 며칠째 배 위에서 대기하고 있었습니다. 지연이 길어질수록 병사들의 체력과 사기는 떨어질 수밖에 없었고, 이 거대한 작전을 계속 비밀로 유지하는 것도 시간이 갈수록 어려워졌습니다.\n\n셋째, 1944년의 기상 예보 기술에는 근본적인 한계가 있었습니다. 인공위성도 없었고, 대서양 한복판의 관측 자료도 제한적이었습니다. 스태그 대령이 종합한 예보는 영국과 미국의 여러 기상팀이 서로 완전히 일치하지 않는 판단을 절충한 결과였고, 그 자신도 이 예보에 상당한 불확실성이 남아 있다는 점을 솔직하게 전달했습니다.\n\n이런 상황에서 두 가지 선택지가 있었습니다.\n\n하나는 이 예보를 믿고 6월 6일 상륙을 강행하는 것이었습니다. 지금이 아니면 다음 기회는 2주 뒤였고, 그동안 병력은 계속 지치고 보안은 계속 위태로워질 터였습니다. 완벽한 확신을 기다리는 것 자체가 애초에 불가능한 상황에서, 연합군 최고의 기상 전문가들이 내놓은 판단을 신뢰하고 움직이는 편이 합리적이라는 논리였습니다.\n\n다른 하나는 상륙을 완전히 접고 다음 조수 조건인 6월 19일경까지 기다리는 것이었습니다. 지금 바다는 여전히 거칠었고, 예보는 어디까지나 '갤 것 같다'는 수준이었습니다. 만약 예보가 틀리면 함포 지원과 공수작전, 상륙정 통제 모두가 흐트러질 수 있었습니다. 복잡하고 정교한 다군종 합동작전을 불확실한 날씨 속에 밀어붙이기보다, 조금 더 확실한 정보를 기다리는 편이 신중해 보였습니다.\n\n두 선택 모두 나름의 근거가 있었고, 둘 다 실제로 군 지휘부 내에서 진지하게 검토되었습니다.\n\n1944년 6월 5일 새벽 4시 15분경, 아이젠하워는 결정을 내렸습니다. 그는 훗날 자신의 기록에서, 결정을 내리기 전 약 30초에서 45초 동안 말없이 앉아 있었다고 회고했습니다. 그리고 그는 상륙을 강행하기로 했습니다. 그의 판단 근거는, 스태그가 제시한 완벽하지는 않지만 실재하는 갬 예보와, 계속 지연될 경우 커지는 병력 피로, 보안 유출 위험, 그리고 다가오는 조수 조건 마감이라는 현실적 제약들을 종합한 것이었습니다.\n\n6월 6일 아침, 예보는 대체로 들어맞았습니다. 날씨는 완벽하지는 않았지만 작전을 수행할 수 있는 수준으로 개었고, 함포 지원과 공수작전, 상륙작전이 계획대로 진행되었습니다. 독일군은 이런 날씨에 상륙이 이루어지리라고 예상하지 못해 방어 태세가 느슨했고, 일부 지휘관은 심지어 자리를 비운 상태였습니다. 연합군은 어느 정도 기습 효과를 거두며 노르망디에 교두보를 확보했습니다.\n\n오늘날 이 이야기는 흔히 '침착한 기상학자와 결단력 있는 사령관이 역사를 바꿨다'는 식의 깔끔한 성공담으로 전해집니다. 하지만 이런 단순화는 한 가지 중요한 사실을 지웁니다. 바로 그 순간에는 아무도, 만약 다른 선택을 했다면 무슨 일이 벌어졌을지 알 수 없었다는 점입니다.\n\n실제로 6월 19일, 영국 해협에는 수십 년 만에 손꼽히는 강력한 폭풍이 몰아쳤습니다. 이 폭풍은 오마하 해변에 설치된 인공 항만 멀베리 A의 방파제를 이루던 28개의 케이슨 중 21개를 파괴할 만큼 강력했습니다. 만약 상륙이 6월 6일이 아니라 이 다음 조수 조건인 6월 19일 무렵으로 미뤄졌다면, 상륙 함대와 병력이 이 폭풍 한복판에 있었을 가능성이 있었습니다. 물론 그날 실제로 상륙을 시도했다면 정확히 어떤 일이 벌어졌을지는 아무도 확실히 말할 수 없습니다. 이는 검증할 수 없는 가정이며, 이 사건이 보여주는 것은 '기다리는 쪽이 무조건 나았을 것'이라는 확신이 아니라, '더 안전해 보이는 선택이 실제로는 더 안전하지 않았을 수도 있다'는 가능성입니다.\n\n다시 T0의 시점으로 돌아가 봅시다. 아이젠하워와 참모들이 그 새벽에 실제로 가지고 있던 것은, 불확실하지만 전문적인 예보와, 지연의 구체적인 비용들, 그리고 좁아지는 시간의 창이었습니다. 그들이 갖고 있지 않았던 것은, 두 선택지 중 어느 쪽이 실제로 '더 안전한' 선택인지에 대한 확실한 답이었습니다.\n\n이 지점에서 판단의 질과 결과의 질을 구분해볼 필요가 있습니다. 아이젠하워의 결정은 무모한 도박이 아니라, 전문가의 판단과 지연의 실질적 비용을 함께 저울질한, 정보에 근거한 선택이었습니다. 그는 하루 전 실제로 연기를 택한 전례도 있었기에, 무조건 밀어붙이는 사람이 아니라 정보에 따라 움직이는 사람이었다는 점도 뒷받침됩니다. 그리고 그 결과는 좋았습니다. 다만 그 좋은 결과가 예보의 정확함 덕분인지, 혹은 상황이 어떻든 상륙 자체는 어느 정도 성공했을 것인지, 우리는 완전히 단정할 수 없습니다.\n\n만약 당신이 그 새벽 사우스윅 하우스에 있었고, 15만 명이 이미 배 위에서 기다리고 있으며, 다음 기회는 2주 뒤라는 말을 들었다면, 그 애매한 예보를 믿고 지금 움직였을까요, 아니면 조금 더 확실한 날을 기다렸을까요. 그리고 그 선택이 좋은 결과로 이어졌다면, 그것은 온전히 당신의 판단 덕분이었을까요, 아니면 당신이 그 순간 알 수 없었던 어떤 우연 덕분이었을까요."
}
