{
  "case_id": "karluk-expedition-1914",
  "hook": "당신과 동료 스무 명 남짓은 부빙 위에 고립되어 있습니다. 이미 두 무리, 여덟 명이 같은 얼음을 건너려다 사라졌습니다. 아무도 당신들이 여기 있다는 사실을 모릅니다. 다 함께 나머지 얼음길을 건너 뭍으로 향할 것인가, 아니면 가장 튼튼한 두 사람만 먼저 보내 도움을 구하고 나머지는 이곳에서 기다릴 것인가. 어느 쪽이든, 사람이 죽을 수 있습니다.",
  "short_setup": "1914년 1월, 캐나다 북극 탐사대의 배 칼럭호가 시베리아 앞바다 추크치해의 유빙에 부서져 가라앉았습니다. 생존자들은 몇 주에 걸쳐 얼음 위를 이동해 랭겔 섬에 도착했지만, 그 과정에서 이미 두 무리, 여덟 명이 실종되었습니다. 선장 로버트 바틀렛은 애초에 전원이 함께 시베리아 본토까지 건너갈 계획이었습니다. 하지만 랭겔 섬에 도착한 뒤, 그는 계획을 바꿔야 할지 고민에 빠집니다.",
  "why_option_a_made_sense": "원래 계획대로 전원이 함께 시베리아로 건너가는 방안에는 나름의 논리가 있었습니다. 가장 경험 많은 지휘관인 바틀렛과 떨어지지 않고, 썰매를 끌고 길을 뚫을 손이 많아진다는 이점이 있었습니다. 무엇보다, 소수만 먼저 보내고 나머지는 무기한 랭겔 섬에서 기다리는 방식은 그 구조 시도가 성공하리라는 보장이 전혀 없는 상태에서 다수를 낯선 섬에 방치하는 것이나 다름없었습니다. 다 함께 움직인다면, 성공하든 실패하든 최소한 모두가 같은 운명을 나누게 됩니다.",
  "why_option_b_made_sense": "반면 소수의 정예만 먼저 보내는 방안에도 강력한 근거가 있었습니다. 이미 이 부빙을 건너려던 두 무리, 총 여덟 명이 실종된 뒤였습니다. 대원 대부분은 북극 경험이 거의 없었고, 일부는 부상까지 입은 상태였습니다. 그런 사람들을 이끌고 또 한 번 위험한 얼음길을 강행하는 것보다, 가장 경험 많은 이누피아트 사냥꾼 카타크토빅과 단둘이 가볍고 빠르게 움직이는 편이 실제로 도움을 구해올 가능성이 더 높다는 판단이었습니다. 남은 이들은 최소한 랭겔 섬에서 사냥감과 땔감이라도 구할 수 있었습니다.",
  "actual_decision_explanation": "바틀렛은 랭겔 섬에 도착한 뒤, 첫 이동 과정의 참혹함을 겪고 나서 원래 계획을 바꿨습니다. 대다수 대원이 북극 경험이 없다는 점을 근거로, 그는 자신과 카타크토빅 단 둘이서만 시베리아로 향하고, 나머지 약 열다섯 명은 랭겔 섬에 남기로 했습니다. 1914년 3월 18일, 두 사람은 개 일곱 마리와 48일치 식량을 가지고 섬을 떠났습니다. 이 결정은 당시 이용 가능한 정보, 즉 앞선 두 무리의 실종과 대원들의 경험 부족을 근거로 내려진 것이었지만, 외부의 확인이나 지원 없이 오직 현장의 판단만으로 이루어졌습니다.",
  "outcome_story": {
    "immediate": "바틀렛과 카타크토빅은 약 6주에 걸쳐 얼음 위를 이동한 끝에 1914년 4월 초 시베리아 해안에 도착했습니다. 이후 해안을 따라 이동하다 포경선을 만나 마침내 외부 세계에 소식을 전할 수 있었습니다. 하지만 첫 구조선이었던 미국 세관 순시선 베어호는 얼음 때문에 랭겔 섬에 접근하지 못했습니다.",
    "long_term": "1914년 9월 7일, 침몰로부터 거의 8개월 만에 스쿠너 킹 앤 윙호가 랭겔 섬에 도착해 남아있던 생존자 열네 명을 구조했습니다. 하지만 바틀렛이 자리를 비운 그 여섯 달 동안, 섬에서는 대원 세 명이 추가로 목숨을 잃었습니다. 이 사건은 이후 수십 년간 바틀렛과 탐사대장 빌햐울무르 스테판손 사이의 책임 공방으로 이어졌고, 훗날 역사학자들이 새로 발굴한 편지와 기록을 통해 재조명되었습니다."
  },
  "hindsight_analysis": "결과만 보면 '소수를 먼저 보낸 판단이 옳았다'고 말하고 싶어집니다. 실제로 그 선택 덕분에 열네 명이 살아 돌아왔으니까요. 하지만 T0 시점으로 돌아가면, 이 판단이 결코 명쾌한 정답은 아니었습니다. 첫째, 바틀렛이 소수만 데리고 떠난 뒤, 남은 이들은 여섯 달 가까이 아무 연락도 없이 기다려야 했고 그 사이 세 명이 목숨을 잃었습니다. 만약 바틀렛과 카타크토빅이 도중에 실종되었다면, 남은 사람들의 위치를 아는 사람은 이 세상에 아무도 없었을 것입니다. 즉 이 선택 역시 결코 안전한 길이 아니라, 다른 종류의 큰 위험을 감수한 선택이었습니다. 둘째, 이 결정을 온전히 '바틀렛의 뛰어난 판단력' 이야기로만 읽는 것은 전체 그림을 지우는 일입니다. 애초에 칼럭호가 왜 그렇게 위험한 얼음 지대로 들어갔는지, 그리고 그 과정에서 바틀렛 자신이 어떤 역할을 했는지를 두고는 지금까지도 역사학자들 사이에 논쟁이 있습니다. 셋째, 이 결정에 앞서 이미 두 무리, 여덟 명이 같은 얼음을 건너려다 사라진 상태였습니다. 이는 '소수 정예가 더 안전하다'는 판단을 뒷받침하는 근거이기도 했지만, 동시에 이 지역의 얼음이 인원수와 상관없이 얼마나 치명적인지를 보여주는 증거이기도 했습니다. 결정의 질과 결과의 질을 구분해서 보면, 바틀렛의 판단은 당시 확보 가능한 정보에 비추어 합리적(REASONABLE)이었다고 평가할 수 있습니다. 하지만 그 결과는 단순히 '좋았다'고 하기 어렵습니다. 대다수는 살아 돌아왔지만, 세 명이 기다리는 동안 목숨을 잃었고, 애초에 다섯 배 가까운 사람이 이미 이 표류 사고 전체 과정에서 사망한 뒤였습니다. 이 사건이 보여주는 것은, 극한 상황에서는 어떤 선택을 하든 진짜 안전한 길은 존재하지 않을 수 있다는 사실입니다.",
  "decision_principle": {
    "plain_language": "이미 여러 사람이 같은 방식으로 실패한 상황에서는, 더 많은 인원이 함께 움직이는 것이 아니라 가장 준비된 소수만 앞세우는 쪽이 합리적으로 보이기 쉽습니다. 하지만 이 판단은 위험을 없애는 것이 아니라, 위험을 한쪽(소수의 이동)에서 다른 쪽(다수의 기약 없는 대기)으로 옮기는 것일 뿐이라는 사실을 놓치기 쉽습니다.",
    "tag": "Risk transfer, not risk removal"
  },
  "longform_story": "1914년 1월 11일, 캐나다 북극 탐사대의 배 칼럭호는 추크치해의 유빙에 짓눌려 가라앉았습니다. 배에 타고 있던 스물다섯 명은 미리 얼음 위로 옮겨둔 물자와 함께 '난파 캠프'를 차리고, 그곳에서 다음 계획을 세워야 했습니다.\n\n선장 로버트 바틀렛의 처음 계획은 단순했습니다. 전원이 함께 근처의 랭겔 섬으로 이동한 뒤, 그곳에서 다시 다 함께 시베리아 본토로 건너간다는 것이었습니다. 하지만 현실은 계획대로 흘러가지 않았습니다.\n\n1월 21일, 바틀렛은 앞서 길을 뚫을 선발대 네 명을 내보냈습니다. 이들은 다시는 발견되지 않았습니다(이들의 유해는 10년 뒤인 1924년, 인근 헤럴드 섬에서 발견되었습니다). 2월 초에는 선의(船醫) 앨리스터 매케이를 포함한 네 명이 바틀렛의 만류에도 불구하고 독자적으로 캠프를 떠났습니다. 이들 역시 끝내 발견되지 않았습니다. 스물다섯 명 중 이미 여덟 명이 이 얼음 위에서 사라진 셈이었습니다.\n\n남은 사람들은 몇 주에 걸쳐 100피트에 달하는 압력 능선을 넘으며 랭겔 섬에 도착했습니다. 그 과정 자체가 이미 참혹했습니다. 부상자가 나왔고, 모두가 지쳐 있었습니다.\n\n이것이 이 이야기의 T0입니다. 랭겔 섬에 도착한 바틀렛은 원래 계획, 즉 전원이 함께 시베리아까지 건너간다는 계획을 다시 검토해야 했습니다.\n\n그가 그 순간 알고 있던 것은 이랬습니다. 이미 같은 종류의 얼음길에서 두 무리, 여덟 명이 사라졌습니다. 남은 대원 대부분은 북극 경험이 전혀 없었고, 몇몇은 다쳐 있었습니다. 반면 이누피아트 사냥꾼 카타크토빅은 얼음 위 장거리 이동에 능숙했습니다. 그리고 무엇보다, 이 세상 그 누구도 이들이 랭겔 섬에 있다는 사실을 알지 못했습니다. 칼럭호는 이미 몇 달 전, 전혀 다른 위치에서 실종된 것으로 보고되어 있었습니다.\n\n선택지는 두 가지였습니다.\n\n하나는 원래 계획대로 전원이 함께 나머지 얼음길을 건너는 것이었습니다. 지휘관과 떨어지지 않고, 썰매를 끌 손도 많아진다는 장점이 있었습니다. 무엇보다, 소수만 먼저 보내고 나머지가 기약 없이 기다리는 상황 자체를 피할 수 있었습니다.\n\n다른 하나는 무리를 나누는 것이었습니다. 바틀렛과 카타크토빅, 단 두 사람만 가볍고 빠르게 움직여 도움을 구하고, 나머지 약 열다섯 명은 땔감과 사냥감이 있는 랭겔 섬에 남아 기다리는 방안이었습니다.\n\n두 선택 모두 나름의 근거가 있었고, 둘 다 사람이 죽을 수 있는 도박이었습니다. 전원이 함께 움직인다면, 이미 두 번이나 이 얼음이 사람을 삼킨 전례가 있는 상황에서, 경험 없는 대원들까지 포함한 큰 무리 전체가 한 번에 사라질 위험이 있었습니다. 무리를 나눈다면, 남은 사람들은 언제 끝날지 모르는 기다림 속에 놓이게 되고, 만약 바틀렛과 카타크토빅마저 실종된다면 그 누구도 랭겔 섬에 사람이 있다는 사실조차 알 수 없게 됩니다.\n\n바틀렛은 무리를 나누는 쪽을 택했습니다. 1914년 3월 18일, 그는 카타크토빅과 함께 개 일곱 마리, 48일치 식량을 챙겨 섬을 떠났습니다.\n\n두 사람은 약 6주에 걸쳐 얼음 위를 이동한 끝에 4월 초 시베리아 해안에 닿았습니다. 이후 해안을 따라 걸어 마침내 포경선을 만났고, 그렇게 외부 세계에 소식이 전해졌습니다. 하지만 첫 구조선인 미국 세관 순시선 베어호는 얼음 때문에 랭겔 섬 근처까지 갈 수 없었습니다.\n\n랭겔 섬에 남은 사람들은 그 사이 계속 기다려야 했습니다. 바틀렛이 떠난 뒤 여섯 달 가까운 시간 동안, 대원 세 명이 목숨을 잃었습니다. 1914년 9월 7일, 마침내 스쿠너 킹 앤 윙호가 섬에 도착해 남은 열네 명을 구조했습니다. 침몰로부터 거의 8개월 만이었습니다.\n\n오늘날 이 이야기는 종종 '바틀렛의 영웅적인 결단'으로 단순화되어 전해집니다. 실제로 그는 구조선에 직접 동승해 돌아올 만큼 대원들을 끝까지 챙겼습니다. 하지만 이 단순화는 몇 가지를 지웁니다.\n\n첫째, 애초에 칼럭호가 왜 그렇게 위험한 얼음 지대로 들어갔는지, 그 과정에서 바틀렛 자신이 어떤 역할을 했는지를 두고는 지금까지도 역사학자들 사이에 첨예한 논쟁이 있습니다. 둘째, 무리를 나눈 결정이 위험을 없앤 것이 아니라 다른 형태의 위험, 즉 기약 없는 기다림으로 옮겼을 뿐이라는 사실입니다. 실제로 그 기다림 속에서 세 명이 더 목숨을 잃었습니다.\n\n결정의 질과 결과의 질을 구분해서 봐야 하는 지점이 바로 여기입니다. 바틀렛의 판단은 당시 확보 가능한 정보, 즉 앞선 두 무리의 실종과 대원들의 경험 부족이라는 근거에 비추어 합리적인 선택이었습니다. 하지만 그 결과를 '좋았다'고만 부르기는 어렵습니다. 대다수는 살아 돌아왔지만, 그 과정에서 스물다섯 명 중 열한 명이 목숨을 잃었습니다.\n\n만약 당신이 그 얼음 위에 서 있었고, 이미 여덟 명이 같은 얼음 때문에 사라진 것을 알고 있었다면, 다 함께 움직이겠습니까, 아니면 가장 강한 두 사람만 먼저 보내고 나머지는 기다리겠습니까. 그리고 어느 쪽을 택하든, 그것이 '안전한 선택'이 아니라 그저 '다른 위험을 고르는 선택'이었다는 사실을 받아들일 수 있겠습니까."
}
