{
  "case_id": "barry-marshall-self-experiment-1984",
  "hook": "당신은 어떤 병의 원인을 알아냈다고 확신합니다. 하지만 아무도 믿지 않습니다. 동물 실험은 실패했고, 사람을 대상으로 한 정식 임상시험은 승인받는 데만 몇 년이 걸릴 수 있습니다. 그동안 환자들은 계속 같은 방식으로 치료받다가, 어떤 이는 위(胃)를 통째로 잘라내는 수술까지 받습니다. 계속 논문을 쓰고 기다릴 것인가, 아니면 그 병원균을 직접 마셔서 스스로 증명할 것인가.",
  "short_setup": "1984년, 호주 프리맨틀 병원의 젊은 내과 의사 배리 마셜은 병리학자 로빈 워런과 함께, 위궤양이 스트레스나 위산 과다가 아니라 나선형 세균 감염 때문에 생긴다는 이론을 세웠습니다. 하지만 동물에게는 이 균이 감염되지 않았고, 동료 의사들과 학회는 이 주장을 비웃거나 무시했습니다. 궤양 치료제 시장은 이미 연간 수십억 달러 규모였고, 그 약들은 병을 낫게 하는 것이 아니라 증상만 억누르는 약이었습니다. 사람을 대상으로 한 제대로 된 항생제 임상시험은 승인도, 자금도 요원해 보였습니다.",
  "why_option_a_made_sense": "정석대로 가는 길에는 분명한 이유가 있었습니다. 사람에게 실험적인 항생제를 함부로 투여하는 것은 연구 윤리상 원래도 조심스러운 일이었고, 마셜 자신도 동료들에게 이 자가 실험 아이디어를 넌지시 꺼냈을 때 '미친 짓'이라는 반응을 들었습니다. 임상시험 자금을 댈 위원회도, 함께 일하는 의료진 대부분도 이 세균 이론을 진지하게 받아들이지 않는 상황에서, 계속 논문을 쌓고 정식 승인 절차를 밟는 것이 훨씬 안전하고 책임 있는 선택으로 보였습니다. 시간이 걸리더라도, 제대로 된 무작위 대조 시험 하나가 나오면 그것이 훨씬 강력하고 널리 인정받는 증거가 될 터였습니다.",
  "why_option_b_made_sense": "반면 직접 마시는 쪽에도 나름의 논리가 있었습니다. 이미 새끼돼지 네 마리로 몇 달을 시도했지만 균이 자리를 잡지 않아 동물 실험 자체가 무산된 상태였습니다. 정식으로 항생제 임상시험을 승인받으려 해도, 그 세균 이론을 믿지 않는 위원회를 먼저 설득해야 하는 모순에 갇혀 있었습니다. 반면 마셜은 이미 자신이 치료한 몇몇 환자에게서 100%의 완치율을 확인했고, 이 균이 무엇에 약한지도 알고 있었습니다. 그리고 무엇보다, 아직 아무도 모르는 이 위험을 놓고 진짜 온전한 동의를 할 수 있는 사람은 이 세상에 자기 자신뿐이라고 판단했습니다.",
  "actual_decision_explanation": "1984년 중반(흔히 7월 말로 알려져 있으나, 마셜 본인의 회고에도 정확한 날짜는 나오지 않습니다), 마셜은 프리맨틀 병원에서 헬리코박터 파일로리 배양액을 직접 마셨습니다. 그는 병원 윤리위원회에 이 실험을 정식으로 신청하지 않았습니다. 훗날 그는 '신청했다가 거부당하면 어차피 몰래 실행하고 결과도 발표하지 못했을 것'이라고 회고했습니다. 대신 그는 담당 내시경 의사와 미생물실 동료의 비공식적인 도움만 받았고, 아내에게도 사전에 알리지 않았습니다.",
  "outcome_story": {
    "immediate": "마신 지 사흘째까지는 별다른 증상이 없었습니다. 이후 며칠에 걸쳐 복부 팽만감, 식욕 저하, 아침마다 신물 없는 구토, 그리고 입 냄새가 나타났습니다. 열흘째 내시경에서 급성 위염과 생검 조직 속 나선균이 확인되었습니다. 그런데 열나흘째 다시 내시경을 했을 때는 여덟 개의 조직 검사 모두에서 균이 검출되지 않았습니다. 마셜은 이때부터 항생제(티니다졸)를 스스로 복용하기로 결정했고, 완전히 회복했습니다.",
    "long_term": "이 실험은 1984년 7월 뉴욕타임스에 소개되며 큰 주목을 받았고, 1985년 호주의학저널에 정식 논문으로 실렸습니다. 하지만 이 한 번의 실험만으로 의학계 전체가 바뀌지는 않았습니다. 이후 10년에 걸친 추가 임상시험과 역학 연구를 거쳐, 1994년 미국 국립보건원(NIH)이 헬리코박터 제균 치료를 공식 권고하면서 비로소 국제적으로 인정받았습니다. 2005년, 마셜과 워런은 이 발견으로 노벨 생리의학상을 공동 수상했습니다."
  },
  "hindsight_analysis": "결과를 알고 나면 이 선택은 '당연히 옳았던 결정'처럼 보입니다. 실제로 노벨상까지 받았으니까요. 하지만 T0 시점으로 돌아가면 이야기는 그렇게 간단하지 않습니다.\n\n첫째, 이 실험이 증명한 것은 정확히 무엇이었을까요? 마셜은 이 균이 건강한 사람에게 위염을 일으킬 수 있다는 것을 보여주었을 뿐, 위염이 실제로 궤양으로 이어지는지, 균을 없애면 궤양이 낫는지는 이 실험만으로는 증명되지 않았습니다. 단 한 사람의 사례는, 아무리 극적이어도 통계적으로는 여전히 'N=1'이었습니다. 실제로 의학계 주류가 이 이론을 받아들이기까지는 이후로도 10년, 그리고 수많은 추가 임상시험이 더 필요했습니다.\n\n둘째, 흔히 알려진 이야기와 달리 마셜 본인의 회고에 따르면 그는 아내의 지시로 항생제를 먹은 것이 아니라 스스로 판단해서 치료를 시작했으며, 심지어 그가 항생제를 먹기도 전에 균이 이미 몸에서 사라지고 있었던 것으로 보입니다. 왜 그렇게 되었는지는 마셜 자신도 지금까지 명확히 설명하지 못합니다. 즉 이 실험이 이렇게 깔끔하게 끝난 데에는, 철저한 계획만큼이나 어느 정도의 운도 작용했을 가능성이 있습니다.\n\n셋째, 이 결정은 병원 윤리위원회를 우회한 결정이었습니다. 마셜은 신청하면 거부당할 것이라고 예상하고 아예 신청하지 않는 쪽을 택했습니다. 이는 스스로에게 위험을 감수하는 용기로 볼 수도 있지만, 동시에 그가 자기 판단만으로 정식 안전장치를 건너뛴 것이기도 합니다. 만약 그가 예상보다 훨씬 심하게 앓았다면, 혹은 회복하지 못했다면, 이 이야기는 지금과는 전혀 다르게 기억되었을 것입니다.\n\n결정의 질과 결과의 질을 나누어 보면, 마셜의 선택은 합리적(REASONABLE)이라 평가할 수 있습니다. 그는 무작정 뛰어든 것이 아니라 사전 내시경으로 건강 상태를 확인했고, 문제가 생기면 되돌릴 치료법(비스무트와 항생제 병용요법)을 이미 검증해둔 상태였으며, 이 위험을 진짜로 이해하고 동의할 수 있는 사람은 자신뿐이라는 나름의 논리를 갖고 있었습니다. 하지만 이것이 '흠잡을 데 없는 결정'은 아니었습니다. 결과는 좋았지만(GOOD), 그 좋은 결과에는 그가 통제하지 못한 우연, 즉 균이 예상보다 빨리, 이유도 불분명하게 사라져준 행운이 섞여 있었습니다.\n\n그리고 무엇보다 물어야 할 질문은 이것입니다. 이 이야기가 '한 명의 괴짜 과학자가 기득권에 맞서 옳았음이 증명된' 이야기로 널리 회자되는 것 자체가, 우리가 이런 종류의 이야기를 접할 때 이미 결말을 짐작하게 만드는 것은 아닐까요. 실제로 마셜이 동료들에게 이 계획을 말했을 때, 대부분은 '무모하다'고 반응했습니다. 그 순간의 그들에게는, 정석대로 가는 길이 훨씬 상식적인 선택이었습니다.",
  "decision_principle": {
    "plain_language": "정상적인 검증 절차 자체가 그 이론을 믿지 않는 사람들의 손에 달려 있을 때, 그 절차를 기다리는 것과 스스로 위험을 떠안고 증거를 만드는 것 중 무엇이 더 책임 있는 태도인지는 미리 정해져 있지 않습니다. 그리고 어느 쪽을 택하든, 극적으로 성공한 이야기만 기억에 남고 조용히 묻힌 실패들은 잘 보이지 않는다는 점도 함께 기억해야 합니다.",
    "tag": "생존자 편향과 자가 실험의 윤리"
  },
  "longform_story": "1984년, 호주 서부의 프리맨틀 병원. 서른두 살의 내과 의사 배리 마셜은 답답했습니다. 그는 병리학자 로빈 워런과 함께 위(胃) 조직 속에서 나선형으로 생긴 세균을 발견했고, 이 균이 위염과 위궤양의 진짜 원인이라고 확신하고 있었습니다. 당시 의학계의 정설은 궤양이 스트레스, 매운 음식, 과도한 위산 때문에 생긴다는 것이었습니다. 위는 강한 산성 환경이라 세균이 살 수 없다는 것이 상식이었습니다. 마셜과 워런의 주장은 그 상식을 정면으로 거스르는 것이었습니다.\n\n1983년, 두 사람이 학회에 낸 발표 초록은 거부당했습니다. 동료들은 노골적으로 회의적이었습니다. 한 선임 병리학자는 마셜이 보여준 '위염이 나은' 조직 사진을 보고도 '변화가 미묘하네요'라고 심드렁하게 반응했습니다. 마셜은 이 반응이 비논리적이라고 느꼈지만, 그에게는 그들을 설득할 결정적인 증거가 없었습니다.\n\n증거를 얻는 가장 확실한 방법은 이 균을 동물에게 감염시켜 같은 병을 재현하는 것이었습니다. 1984년 초, 마셜은 새끼돼지 네 마리로 이 실험을 시도했습니다. 몇 달에 걸친 시도 끝에도 균은 돼지의 위에 자리 잡지 못했고, 돼지들만 무럭무럭 자라 실험은 결국 흐지부지 끝났습니다. 동물 모델이 없다는 것은 치명적이었습니다. 이 균이 정말로 병을 일으키는지, 아니면 그저 우연히 함께 발견되는 무해한 균인지 증명할 방법이 마땅치 않았습니다.\n\n그러던 중, 마셜은 원인 모를 위 출혈로 입원한 한 젊은 환자를 만났습니다. 이 환자의 혈액에서는 마셜이 만든 시제품 항체 검사에서 강한 양성 반응이 나왔습니다. 하지만 담당 의료진은 기존 방식대로 수혈과 제산제 치료를 이어갔고, 환자는 결국 위 전체를 절제하는 수술을 받았습니다. 마셜은 이 일을 두고두고 마음에 담아두었습니다.\n\n정공법으로 이 이론을 증명하려면 사람을 대상으로 한 항생제 임상시험이 필요했습니다. 하지만 여기에는 근본적인 모순이 있었습니다. 이미 효과가 검증된 치료제(제산제, 비스무트)가 있는 상황에서, 아직 입증되지 않은 세균 이론 때문에 환자에게 실험적인 항생제를 시도하는 것은 윤리적으로 조심스러운 일이었습니다. 게다가 이 임상시험에 자금을 대야 할 위원회조차 세균 이론 자체를 미심쩍어했습니다. 즉, 이론을 증명해야 할 시험을 하려면, 먼저 그 이론을 믿지 않는 사람들을 설득해야 하는 악순환에 갇혀 있었던 셈입니다.\n\n이것이 T0, 즉 마셜이 결단을 내려야 했던 순간입니다. 그가 그 순간 알고 있던 것은 이랬습니다. 동물 실험은 실패했습니다. 동료들 대부분은 회의적이었고, 개중에는 노골적으로 비웃는 사람도 있었습니다. 정식 임상시험은 자금도, 승인도 요원했습니다. 반면 그는 이미 몇몇 환자에게 비스무트와 항생제 병용요법으로 100%에 가까운 완치를 확인했고, 이 균이 무엇에 약한지도 알고 있었습니다.\n\n선택지는 두 가지였습니다.\n\n하나는 정석대로 가는 것이었습니다. 계속 논문을 쓰고, 자금을 구하고, 언젠가 위원회를 설득해 정식 임상시험을 시작하는 것. 시간이 걸리겠지만, 성공한다면 훨씬 강력하고 반박하기 어려운 증거가 될 터였습니다.\n\n다른 하나는 자기 자신을 실험 대상으로 삼는 것이었습니다. 배양된 균을 직접 마시고, 병이 생기는지 지켜보는 것. 성공하든 실패하든, 적어도 빠르게 답을 얻을 수 있었습니다.\n\n마셜은 두 번째 길을 택했습니다. 그는 병원 윤리위원회에 이 계획을 신청하지 않았습니다. 훗날 그는 이렇게 회고했습니다. '신청했다가 거부당했다면, 나는 어차피 몰래 실행했을 것이고, 그러면 결과를 발표할 수도 없었을 것이다.' 대신 그는 담당 내시경 전문의와 미생물실 동료에게만 비공식적으로 도움을 청했습니다. 아내 에이드리엔에게는 미리 말하지 않았습니다.\n\n1984년 중반의 어느 날 아침, 마셜은 배양 접시에서 긁어낸 균을 육즙에 섞은 뿌연 갈색 액체 한 잔을 단숨에 들이켰습니다.\n\n사흘째까지는 아무 일도 없었습니다. 그러다 배가 더부룩해지고 입맛이 없어졌습니다. 며칠 뒤부터는 매일 아침 신물 없는 맑은 액체를 토했고, 입에서는 아내와 동료들이 알아챌 정도의 냄새가 났습니다. 열흘째, 내시경과 조직 검사에서 급성 위염과 나선균이 확인되었습니다. 그가 세운 이론이 눈앞에서 증명되는 순간이었습니다.\n\n그런데 열나흘째, 다시 내시경을 했을 때는 이상한 일이 벌어졌습니다. 여덟 개의 조직 검사 어디에서도 균이 검출되지 않았습니다. 마셜은 이때 비로소 항생제 복용을 결정했습니다. 이는 그가 스스로 내린 결정이었지, 흔히 알려진 것처럼 아내의 지시 때문이 아니었습니다. 그리고 균이 왜 항생제를 먹기도 전에 이미 사라지고 있었는지는, 마셜 자신도 지금까지 명확히 설명하지 못하는 수수께끼로 남아 있습니다.\n\n이 실험은 1984년 7월 뉴욕타임스에 소개되며 화제가 되었고, 1985년 정식 논문으로 발표되었습니다. 하지만 이것으로 논쟁이 끝난 것은 아니었습니다. 이후로도 10년에 걸친 추가 임상시험과 역학 연구가 이어졌고, 1994년에야 미국 국립보건원이 공식적으로 항생제 치료를 권고했습니다. 2005년, 마셜과 워런은 마침내 노벨 생리의학상을 공동 수상했습니다. 자기 몸에 균을 마신 지 21년 만이었습니다.\n\n오늘날 이 이야기는 종종 '한 괴짜 의사가 몸소 증명해서 의학계를 뒤집었다'는 식으로 단순화되어 전해집니다. 하지만 이 단순화는 몇 가지를 지웁니다. 그 실험은 위염을 일으켰다는 것만 보여주었을 뿐, 궤양과의 연결고리는 이후 다른 연구들이 채워야 했습니다. 균이 사라진 것도 항생제 덕이 아니라 원인 모를 자연 치유였을 가능성이 있습니다. 그리고 그가 병원 윤리위원회를 우회했다는 사실은, 이 이야기를 순수한 영웅담으로만 읽을 수 없게 만듭니다.\n\n결정의 질과 결과의 질을 나누어 보면, 마셜의 선택은 합리적(REASONABLE)이었다고 평가할 수 있습니다. 그는 최소한의 안전장치(사전 내시경, 검증된 치료법, 협조하는 의료진)를 마련해두었고, 이 위험을 진짜로 이해하고 동의할 수 있는 사람은 자신뿐이라는 나름의 논리를 갖고 있었습니다. 하지만 결과가 좋았다(GOOD)고 해서 그 결정이 흠잡을 데 없었다는 뜻은 아닙니다. 그가 통제하지 못한 우연, 즉 균이 예상보다 순하게, 빨리 물러가 준 행운이 이 이야기를 지금 우리가 아는 해피엔딩으로 만드는 데 한몫했습니다.\n\n그리고 마지막으로 생각해볼 질문이 있습니다. 마셜이 동료들에게 이 계획을 말했을 때, 대부분은 '무모하다'고 답했습니다. 그 순간의 그들에게는 정석대로 가는 길이 훨씬 상식적이었습니다. 우리가 지금 이 이야기를 '당연히 그가 옳았다'는 식으로 듣는다면, 그것은 이 이야기가 마침 성공했기 때문에 살아남아 전해지는 이야기라는 사실을 잊고 있는 것은 아닐까요."
}
