{
  "case_id": "whaleship-essex-1820",
  "hook": "당신은 태평양 한가운데, 육지에서 수천 킬로미터 떨어진 곳에서 작은 보트 위에 있습니다. 방금 전까지 타고 있던 배는 가라앉았고, 남은 것은 노와 돛으로 움직이는 보트 세 척, 그리고 며칠어치도 안 되는 식량과 물뿐입니다. 가까운 곳에 섬이 있습니다. 순풍을 타면 2~3주면 닿을 수 있습니다. 하지만 그 섬에 사람을 잡아먹는 풍습이 있다는 소문을 들은 적이 있습니다. 확실히 안전하다고 여겨지는 육지는 그보다 훨씬 멀리, 바람을 거슬러 몇 달을 가야 하는 곳에 있습니다. 당신이라면 어느 쪽으로 노를 젓겠습니까?",
  "short_setup": "1820년 11월 20일, 낸터킷 소속 포경선 에식스호는 남태평양 한가운데서 향유고래에게 두 차례 들이받혀 침몰했습니다. 선장 조지 폴라드 주니어를 포함한 생존자 20명은 세 척의 작은 포경 보트에 나눠 타고 목적지를 정해야 했습니다. 가까운 마르키즈 제도나 소사이어티 제도는 순풍을 타면 2~3주 거리였지만, 항해사들은 그 섬들에 식인 풍습이 있다는 소문을 근거로 반대했습니다. 반대로 남아메리카 해안은 3,000해리가 넘게 떨어져 있었고, 무역풍을 거슬러 가야 하는 훨씬 길고 힘든 항로였습니다.",
  "why_option_a_made_sense": "선장 폴라드는 처음에는 가까운 소사이어티 제도나 마르키즈 제도로 향하자고 제안했습니다. 순풍과 해류를 그대로 타면 2~3주 안에 육지에 닿을 수 있었고, 이는 배에 남은 식량과 물의 양을 생각하면 압도적으로 유리한 선택이었습니다. 항해에 걸리는 시간이 짧을수록 굶주림이나 갈증으로 목숨을 잃을 위험도 그만큼 줄어드는 것이 상식이었습니다. 폴라드에게는 이 판단이 단순한 거리와 바람의 문제였습니다.",
  "why_option_b_made_sense": "하지만 일등항해사 오언 체이스와 이등항해사 매튜 조이는 이 계획에 반대했습니다. 이들은 태평양의 어느 섬들에는 식인 풍습이 있다는 이야기를 들어본 적이 있었고, 가까운 섬들이 바로 그런 곳일지 모른다고 우려했습니다. 실제로 피지나 마르키즈 제도 일부에서는 초기 유럽 방문자들이 의례적 식인 풍습을 기록한 사례가 있었기 때문에, 이 두려움이 완전히 근거 없는 것은 아니었습니다. 다만 그것이 정확히 어느 섬에 해당하는 이야기인지, 지금 향하려는 그 섬이 맞는지는 아무도 직접 확인한 바가 없었습니다. 그럼에도 두 항해사는 차라리 훨씬 멀더라도 사람들이 익히 아는 남아메리카로 향하는 편이 안전하다고 주장했고, 폴라드는 결국 이들의 뜻을 따랐습니다.",
  "actual_decision_explanation": "침몰 직후 하루 이틀 사이, 선장 폴라드와 두 항해사 사이에 목적지를 둘러싼 논쟁이 벌어졌습니다. 폴라드는 처음에 가까운 섬을 제안했지만, 체이스와 조이가 식인종에 대한 두려움을 근거로 반대하자 이를 받아들였습니다. 폴라드는 훗날 이 결정을 두고 '우리는 그들의 손에 잡아먹힐 것을 두려워했다'고 회고했습니다. 이렇게 해서 세 척의 보트는 남아메리카를 향해, 무역풍을 거슬러 남쪽으로 돌았다가 다시 동쪽으로 나아가는 훨씬 긴 항로를 택하게 되었습니다.",
  "outcome_story": {
    "immediate": "항해가 길어지면서 식량과 물이 예정보다 훨씬 빨리 바닥났습니다. 항해 한 달 무렵 무인도인 헨더슨섬에 도착했지만, 섬의 식량만으로는 전원이 버틸 수 없었습니다. 선원 3명이 섬에 남기로 하고, 나머지 17명은 다시 항해를 이어갔습니다. 이후 굶주림과 탈수로 여러 선원이 사망했고, 남은 사람들은 죽은 동료의 시신을 먹으며 버텼습니다. 폴라드가 탄 보트에서는 결국 제비뽑기로 한 명을 정해 총으로 쏘아 식량으로 삼는 일까지 벌어졌으며, 그렇게 선택된 사람은 폴라드의 사촌이었던 오언 코핀이었습니다.",
    "long_term": "20명의 승조원 중 최종적으로 8명만이 살아남았습니다. 1821년 2월, 두 척의 보트에서 생존자 5명이 각각 다른 배에 구조되었고, 같은 해 4월에는 헨더슨섬에 남았던 3명도 구조되었습니다. 오언 체이스가 이듬해 펴낸 항해 기록은 훗날 허먼 멜빌이 소설 『모비 딕』을 구상하는 데 실제로 영향을 준 것으로 알려져 있습니다."
  },
  "hindsight_analysis": "이 사건에서 가장 씁쓸한 지점은, 두려워했던 위험과 실제로 그들을 죽음으로 몬 위험이 전혀 다른 종류였다는 데 있습니다. 항해사들이 걱정한 것은 섬에 도착했을 때 사람들에게 당할 수 있는 폭력이었습니다. 하지만 실제로 그들의 목숨을 앗아간 것은 폭력이 아니라, 항로를 바꾸면서 늘어난 항해 일수와 그만큼 소진된 식량이라는, 단순하고 계산 가능했던 문제였습니다. 흥미로운 것은, 헨더슨섬에 남기로 한 세 사람은 그 '위험하지 않은' 무인도에서 넉 달 넘게 새와 알, 조개를 먹으며 무사히 버텼다는 사실입니다. 즉 두려움의 대상이었던 섬 자체가 실제로는 치명적이지 않았을 가능성을 보여주는 방증이기도 합니다. 그렇다고 이 결정을 내린 사람들을 어리석었다고 단정하기는 어렵습니다. 그들이 들었던 식인 풍습에 대한 소문은 완전한 허구가 아니라, 피지나 마르키즈 제도 일부에서 실제로 기록된 사례에서 비롯된, 다만 부정확하고 과장되게 퍼진 정보였습니다. 문제는 두 위험의 성격이 근본적으로 달랐다는 데 있습니다. 섬 원주민에 대한 위험은 불확실하고 확인할 수 없는 소문이었던 반면, 항로를 늘렸을 때 필요한 식량과 물의 양은 항해사라면 대략적으로 계산할 수 있는 문제였습니다. 검증 불가능한 공포와 계산 가능한 물류 문제를 같은 저울에 올려놓고, 전자를 더 무겁게 판단한 것이 이 결정의 약점이었습니다. 그래서 이 사건은 결정의 질과 결과의 질을 분리해서 볼 필요가 있는 사례입니다. 결과는 명백히 나빴습니다. 20명 중 12명이 목숨을 잃었고, 그 과정에는 인육을 먹는 일과 동료를 죽이는 일까지 포함되어 있었습니다. 하지만 결정 자체를 들여다보면, 이는 단순한 불운이 아니라 애초에 근거가 빈약한 두려움에 더 큰 비중을 둔, 다소 약한 판단이었다고 평가할 수 있습니다. 물론 그 시대 뱃사람들에게 태평양 섬 원주민에 대한 공포가 아주 근거 없는 것만은 아니었다는 점, 그리고 굶주림으로 인한 죽음보다 폭력에 의한 죽음을 더 두려워하는 것이 인간의 자연스러운 반응이라는 점도 함께 고려해야 합니다.",
  "decision_principle": {
    "plain_language": "사람은 눈에 보이지 않고 검증할 수 없는 위협(가령 소문 속의 위험한 사람들)을 실제보다 더 두려워하고, 반대로 눈에 보이지만 서서히 다가오는 위협(가령 줄어드는 식량)은 상대적으로 덜 두려워하는 경향이 있습니다. 특히 그 막연한 위협이 '남에게 해를 입는 것'이고, 서서히 다가오는 위협이 '스스로 견뎌내야 하는 것'일 때 이런 경향은 더 강해집니다.",
    "tag": "생생한 공포 편향 (vividness bias)"
  },
  "longform_story": "1820년 11월 20일, 남태평양 적도 부근, 육지에서 3,200킬로미터 넘게 떨어진 바다 위에서 낸터킷 소속 포경선 에식스호가 침몰했습니다. 몸길이 25미터에 달하는 향유고래 한 마리가 배를 두 차례 들이받았고, 배는 순식간에 옆으로 기울며 가라앉기 시작했습니다. 고래에게 공격당해 침몰한 포경선은 그 이전에 기록된 바가 없었습니다.\n\n선장 조지 폴라드 주니어를 비롯한 스무 명의 선원은 배가 완전히 가라앉기 전, 서둘러 세 척의 작은 포경 보트에 나눠 타고 탈출했습니다. 이 보트들은 원래 고래를 쫓아 작살을 던지기 위한 용도로 만들어진, 길이 7~8미터 남짓의 노와 돛으로 움직이는 무개(無蓋) 소형선이었습니다. 침몰하는 배에서 급히 건져낸 것은 약간의 건빵과 물, 그리고 갈라파고스 땅거북 몇 마리가 전부였습니다.\n\n바로 이 순간이 이 이야기의 T0입니다. 배는 가라앉았고, 스무 명의 목숨은 이제 이 세 척의 작은 보트와, 앞으로 어느 방향으로 노를 저을 것인가 하는 결정에 달려 있었습니다.\n\n그들이 알고 있던 사실은 명확했습니다. 서남서쪽으로 1,200~1,500해리 떨어진 곳에 마르키즈 제도와 소사이어티 제도가 있었고, 순풍과 해류를 그대로 타면 2~3주 안에 도달할 수 있는 거리였습니다. 반대로 남아메리카 해안은 3,000해리가 넘게 떨어져 있었고, 그곳에 가려면 먼저 남쪽으로 내려가 더 남쪽의 편서풍대를 잡은 뒤 다시 동쪽으로 방향을 틀어야 하는, 훨씬 길고 무역풍을 거스르는 항로였습니다.\n\n선장 폴라드는 처음에 가까운 섬으로 향하자고 제안했습니다. 항해 일수가 짧을수록 남은 식량과 물로 버틸 가능성이 높아진다는 것은 단순한 산수였습니다. 그러나 일등항해사 오언 체이스와 이등항해사 매튜 조이는 여기에 반대했습니다. 두 사람은 태평양의 일부 섬에 식인 풍습이 있다는 이야기를 들어본 적이 있었고, 지금 향하려는 섬들이 바로 그런 곳일지 모른다고 우려했습니다. 이 두려움이 완전히 허무맹랑한 것은 아니었습니다. 피지나 마르키즈 제도 일부에서는 실제로 그보다 앞선 시기 유럽 방문자들이 의례적 식인 풍습의 사례를 기록으로 남긴 바 있었습니다. 문제는 그 소문이 부정확하고 낡은 형태로, 어느 섬이 정확히 그런 곳인지 특정하지 못한 채 뱃사람들 사이에 떠돌고 있었다는 점입니다. 실제로 이 무렵 이미 여러 무역선과 포경선이 마르키즈 제도와 소사이어티 제도를 오가며 별다른 충돌 없이 교역을 이어가고 있었지만, 망망대해 위의 선원들이 이런 사실을 확인할 방법은 없었습니다.\n\n결국 폴라드는 두 항해사의 뜻을 받아들였습니다. 그는 훗날 이 결정을 두고, 자신들이 '식인종의 손에 잡아먹힐 것을 두려워했다'고 짧게 회고했습니다. 세 척의 보트는 가까운 섬을 등지고, 남쪽으로 방향을 잡은 뒤 남아메리카를 향한 훨씬 긴 항해를 시작했습니다.\n\n항해가 길어지면서 우려는 곧 현실이 되었습니다. 식량과 물은 예상보다 훨씬 빠르게 줄어들었습니다. 항해를 시작한 지 한 달 남짓 지났을 무렵, 세 보트는 무인도인 헨더슨섬에 다다랐습니다. 하지만 이 작은 섬의 자원만으로는 스무 명 전원이 버틸 수 없었습니다. 선원 세 명이 섬에 남기로 했고, 나머지 열일곱 명은 다시 바다로 나섰습니다.\n\n이후 몇 주 사이, 굶주림과 탈수로 선원들이 하나둘 목숨을 잃기 시작했습니다. 남은 사람들은 죽은 동료의 시신을 먹으며 버텼습니다. 그리고 폴라드가 탄 보트에서는, 더는 자연사한 시신이 남아 있지 않게 되자 결국 제비뽑기로 한 사람을 정해 총으로 쏘는 일까지 벌어졌습니다. 그렇게 뽑힌 사람은 폴라드의 사촌인 오언 코핀이었고, 방아쇠는 코핀 자신의 동의 아래 다른 선원이 당겼습니다.\n\n1821년 2월, 마침내 두 척의 보트가 남아메리카 인근 바다에서 다른 배들에 발견되었습니다. 생존자는 모두 다섯 명뿐이었습니다. 같은 해 4월에는 헨더슨섬에 남았던 세 사람도 구조되었는데, 이들은 그 넉 달 동안 섬의 새와 알, 조개를 먹으며 스스로 살아남아 있었습니다. 스무 명 중 최종 생존자는 여덟 명이었습니다.\n\n오늘날 이 사건은 흔히 '바다 위의 참혹한 식인 이야기'로 단순화되어 회자됩니다. 하지만 그 단순화는 이 이야기의 진짜 핵심, 즉 그들이 두려워한 위험과 실제로 그들을 죽인 위험이 서로 달랐다는 사실을 가려버립니다. 항해사들이 걱정한 것은 섬에 도착했을 때 마주칠지 모를 원주민의 폭력이었습니다. 그러나 실제로 목숨을 앗아간 것은 항로를 늘리면서 소진된 식량과 물이라는, 훨씬 단순하고 계산 가능했던 문제였습니다. 헨더슨섬에 남았던 세 사람이 그 '위험하다고 여겨졌던' 무인도에서 무사히 살아남았다는 사실은, 그들이 짊어졌던 공포의 실체가 얼마나 막연했는지를 보여주는 방증이기도 합니다.\n\n그렇다고 이 판단을 단순히 '어리석었다'고 단정하기는 어렵습니다. 그들이 들었던 소문은 완전한 허구가 아니라, 태평양 일부 섬에서 실제로 기록된 사례에서 비롯된, 다만 부정확하고 과장되게 퍼진 정보였습니다. 낯선 사람들에게 살해당할지 모른다는 공포와, 서서히 굶주려 죽어갈 수 있다는 위험을 같은 저울 위에 놓고 비교하는 일은 그때나 지금이나 결코 쉬운 계산이 아닙니다.\n\n다만 이 사건이 결정의 질과 결과의 질을 분리해서 봐야 하는 이유는 분명합니다. 결과는 명백히 나빴습니다. 스무 명 중 열두 명이 목숨을 잃었고, 그 과정에는 인육을 먹는 일과 동료를 죽음으로 내모는 일까지 포함되어 있었습니다. 그러나 이 결과가 곧 그들이 마주했던 선택 자체가 애초부터 답이 정해진 문제였다는 뜻은 아닙니다. 검증할 수 없는 소문에 기반한 막연한 공포와, 항해 경험상 어느 정도 계산할 수 있었던 식량·물 소요량이라는 구체적인 위험을 견주었을 때, 후자를 가볍게 여긴 판단은 다소 약한 결정이었다고 평가할 수 있습니다. 만약 당신이 그 순간 그 보트 위에 있었다면, 확인할 수 없는 소문 속의 위험과, 계산할 수는 있지만 훨씬 커 보이는 항해 거리 중 무엇을 더 두려워했겠습니까."
}
