{
  "case_id": "shackleton-endurance-1915",
  "hook": "당신의 배는 얼음 바다 한가운데를 한 달 넘게 밀고 나아가고 있습니다. 눈앞에 빙하 끝자락의 만이 보입니다. 상륙할 수 있는 평평한 얼음 둔치까지 있습니다. 하지만 원래 목표로 삼았던 상륙지는 아직 며칠 더 남쪽에 있습니다. 지금 여기서 내리면, 나중에 대륙을 걸어서 횡단해야 할 대원들은 그만큼 더 먼 거리를 썰매로 가야 합니다. 계속 남쪽으로 밀고 가면, 얼음이 더 두꺼워지고 있다는 것도 이미 알고 있습니다. 몇 주 전, 그 지역 고래잡이들은 올해 얼음이 유난히 심하다고 경고했습니다. 지금 멈출 것인가, 계속 갈 것인가.",
  "short_setup": "1914년 12월, 어니스트 섀클턴이 이끄는 인듀어런스호는 남극 대륙 횡단이라는 목표를 안고 웨델해의 유빙 지대를 뚫고 남하하고 있었습니다. 출항 전 사우스조지아섬의 고래잡이들은 그해 웨델해의 얼음이 유난히 심하다고 경고했고, 섀클턴은 이 경고를 받아들여 한 달 가까이 출항을 늦추기도 했습니다. 1915년 1월 15일 무렵, 배는 상륙 가능해 보이는 한 빙하 만—섀클턴이 훗날 '빙하만(Glacier Bay)'이라 이름 붙인 곳—에 다다릅니다. 목표로 삼았던 바셀만까지는 아직 60~80해리가 남아 있었습니다. 여기서 내릴 것인가, 계속 남쪽으로 밀고 갈 것인가가 이 순간의 갈림길이었습니다.",
  "why_option_a_made_sense": "이 원정의 진짜 목표는 남극 대륙에 상륙하는 것 자체가 아니라, 그곳에서 출발해 대륙을 걸어서 횡단하는 것이었습니다. 배로 남하하는 거리가 늘어날수록, 대원들이 썰매로 걸어야 할 거리는 줄어듭니다. 섀클턴 자신도 훗날 이렇게 썼습니다. '바셀만보다 북쪽에서는, 정말 어쩔 수 없는 경우가 아니면 상륙할 생각이 없었다. 남쪽으로 1마일을 더 가는 것은 나중에 썰매로 걸어야 할 거리를 1마일 줄이는 것과 같았다.' 게다가 배는 그 순간까지도, 비록 느리지만 꾸준히 남쪽으로 나아가고 있었습니다. 완전히 막힌 길이 아니었습니다. 웨델해에서 배가 몇 달간 얼음에 갇혔다가 무사히 빠져나온 선례(1912년 독일 필히너 탐험대의 도이칠란트호)도 있었기에, 얼음에 갇히는 것 자체가 곧바로 재앙을 뜻하지는 않는다는 근거도 있었습니다.",
  "why_option_b_made_sense": "반면 멈춰서 상륙할 이유도 분명했습니다. 사우스조지아의 고래잡이들은 실제 경험에 근거해 그해 얼음이 유난히 심하다고 구체적으로 경고했고, 섀클턴은 이 경고를 이미 한 번 진지하게 받아들여 출항 자체를 한 달 가까이 늦춘 바 있었습니다. 웨델해는 원래도 배가 거의 들어가지 않는 험난한 바다로 알려져 있었고, 1902~1904년 스코틀랜드 탐험대는 이곳에서 위험한 얼음 상태를 만나 결국 되돌아간 전례도 있었습니다. 지금 눈앞에 나타난 '빙하만'은 이미 상륙 가능성이 확인된, 손에 잡히는 대안이었습니다. 얼음이 언제 완전히 막힐지 아무도 알 수 없는 상황에서, 확실한 상륙지를 포기하고 더 남쪽으로 도박을 거는 것은 신중하지 못한 선택으로 보일 수도 있었습니다.",
  "actual_decision_explanation": "1915년 1월 15일 무렵, 섀클턴은 선장 프랭크 워슬리와 함께 배를 이끌며 '빙하만'을 그대로 지나쳐 남쪽으로 계속 나아가기로 했습니다. 그가 남긴 기록에 따르면, 이 결정의 근거는 명확했습니다. 바셀만보다 북쪽에서는 정말 필요한 경우가 아니면 상륙하지 않겠다는 것, 그리고 배로 남하하는 거리만큼 대원들의 썰매 여정이 줄어든다는 계산이었습니다. 이 결정은 배가 여전히, 비록 느리게나마, 남쪽으로 나아가고 있던 상황에서 내려졌습니다.",
  "outcome_story": {
    "immediate": "결정 이후 얼음은 더욱 두꺼워졌고, 1915년 1월 18~19일 무렵 인듀어런스호는 얼음 속에 완전히 갇히고 말았습니다. 목표했던 바셀만까지는 채 100해리도 남지 않은 지점이었습니다. 배는 그 상태로 남극의 겨울을 나며 얼음과 함께 표류했습니다.",
    "long_term": "인듀어런스호는 표류 10개월 만인 1915년 11월 21일, 얼음의 압력을 견디지 못하고 부서져 침몰했습니다. 계획했던 남극 대륙 횡단은 끝내 시도조차 되지 못했습니다. 이후 대원들이 유빙 위에서 버티고, 구명보트로 엘리펀트섬까지 이동하고, 섀클턴이 다시 사우스조지아까지 항해해 구조를 조직한 이야기는 훗날 그를 '위기의 리더십'의 상징으로 만들었습니다. 다만 그 명성은 배가 이미 얼음에 갇힌 '이후'의 결정들에서 비롯된 것이며, 애초에 얼음을 뚫고 계속 남하하기로 한 이 결정과는 구분해서 볼 필요가 있습니다."
  },
  "hindsight_analysis": "이 사건에서 가장 조심해야 할 함정은, 배가 결국 얼음에 갇혀 침몰했다는 결말을 알고 나서 '애초에 무리한 도박이었다'고 단정하는 것입니다. 하지만 그 순간 섀클턴에게는 그렇게 확신할 근거가 없었습니다. 그는 웨델해에서 배가 몇 달씩 얼음에 갇혔다가도 무사히 풀려난 선례를 알고 있었고, 그의 배는 그 순간까지도 느리지만 분명히 남하하고 있었습니다. 반면 그가 놓친 것은, 그해가 실제로 유난히 심한 얼음 해였다는 고래잡이들의 경고를 이미 한 번 진지하게 받아들였으면서도, 눈앞에 확실한 대안이 나타난 순간에는 다시 그 경고의 무게를 충분히 되새기지 않았다는 점입니다. 이 결정을 '명백한 실수'로도, '어쩔 수 없었던 선택'으로도 단순화하지 않는 것이 중요합니다. 원정의 목적 자체가 대륙 횡단이었다는 점에서, 남하 거리를 최대한 확보하려 한 논리는 합리적이었습니다. 동시에, 구체적이고 최근에 받은 경고를 정확히 그 경고가 가리키는 상황에서 다시 충분히 고려하지 않은 것도 사실입니다. 판단의 질을 보면, 이 결정은 '명백히 훌륭했다'고도 '명백히 무모했다'고도 하기 어려운, 정당화 가능하지만 완전히 검증되지는 않은 선택—REASONABLE—에 가깝습니다. 그리고 결과는 분명히 나빴습니다. 이 둘을 하나로 뭉뚱그리지 않는 것, 그것이 이 사건이 주는 핵심 질문입니다.",
  "decision_principle": {
    "plain_language": "이미 한 번 심각하게 받아들인 경고라도, 시간이 지나고 상황이 조금씩 진전되면 그 경고의 무게는 조용히 옅어지는 경향이 있습니다. 특히 목표에 가까워지고 있다는 감각이 있을 때, 사람은 이미 들었던 위험 신호보다 눈앞의 진전을 더 크게 느끼기 쉽습니다.",
    "tag": "Sunk-progress bias / warning erosion"
  },
  "longform_story": "1914년 11월, 사우스조지아섬 그리트비켄 항구. 어니스트 섀클턴의 인듀어런스호는 남극으로 떠나기 전 마지막 기항지에 머무르고 있었습니다. 그곳의 고래잡이 선장들은 섀클턴에게 실제 경험에서 우러난 조언을 건넸습니다. 그해 웨델해의 얼음 상태가 유난히 심각하다는 것이었습니다. 섀클턴은 이 경고를 가볍게 넘기지 않았습니다. 원래 며칠만 머물 계획이었던 사우스조지아 체류를 거의 한 달 가까이 늘리며, 남쪽의 얼음이 조금이라도 풀리기를 기다렸습니다.\n\n1914년 12월 5일, 인듀어런스호는 마침내 남쪽으로 출항했습니다. 12월 7일부터는 본격적인 유빙 지대에 들어섰습니다. 이후 몇 주 동안, 배는 얼음덩어리를 밀어붙이고 쪼개가며 조금씩, 아주 느리게 남쪽으로 나아갔습니다. 하루에 몇 마일밖에 나아가지 못하는 날도 있었습니다.\n\n그리고 1915년 1월 15일 밤, 배는 거대한 빙하의 끝자락에 형성된 한 만에 다다랐습니다. 섀클턴은 훗날 이렇게 기록했습니다. \"높이 400~500피트에 달하는 이 빙하의 북쪽 끝에 형성된 만은 훌륭한 상륙지가 될 수 있었다. 해수면보다 3피트가량 높은 평평한 얼음 둔치는 마치 자연이 만든 부두 같았다.\" 그는 이곳을 '빙하만(Glacier Bay)'이라 이름 붙였습니다.\n\n이 순간이 이 이야기의 T0입니다. 배는 아직 목표했던 바셀만에 도달하지 못했습니다. 정확한 거리는 기록마다 조금씩 다르지만, 대략 60에서 80해리가 남아 있었습니다. 지금 여기서 상륙한다면, 확실한 발판을 확보할 수 있었습니다. 반면 계속 남하한다면, 대륙 횡단에 나설 대원들이 걸어야 할 거리를 그만큼 줄일 수 있었습니다.\n\n섀클턴은 멈추지 않았습니다. 그는 훗날 이렇게 썼습니다. \"바셀만보다 북쪽에서는, 정말 어쩔 수 없는 경우가 아니면 상륙할 생각이 없었다. 남쪽으로 1마일을 더 가는 것은, 나중에 썰매로 걸어야 할 거리를 1마일 줄이는 것과 같았기 때문이다.\" 이 원정의 궁극적 목표는 남극에 발을 딛는 것이 아니라, 그곳에서부터 대륙 전체를 걸어서 횡단하는 것이었습니다. 배로 남하할 수 있는 거리는 곧 대원들이 걷지 않아도 되는 거리였습니다.\n\n이 판단에는 나름의 근거가 있었습니다. 배는 그 순간까지도, 비록 느리지만 계속 남쪽으로 나아가고 있었습니다. 완전히 막다른 길이 아니었습니다. 게다가 웨델해에서 배가 얼음에 갇힌다고 해서 반드시 파국으로 끝나는 것도 아니었습니다. 불과 몇 년 전인 1912년, 독일 필히너 탐험대의 배 도이칠란트호는 웨델해에서 무려 여덟 달 가까이 얼음에 갇혀 있다가 결국 큰 손상 없이 풀려난 적이 있었습니다. '갇힌다'는 것이 곧 '침몰한다'는 뜻은 아니었습니다.\n\n하지만 동시에, 섀클턴이 이미 한 번 진지하게 받아들였던 경고—사우스조지아 고래잡이들의 경고—는 여전히 유효했습니다. 웨델해는 원래도 배가 거의 들어가지 않는 험난한 바다로 알려져 있었습니다. 1902년부터 1904년까지 이곳을 탐사했던 스코틀랜드 탐험대는 위험한 얼음 상태를 만나 결국 후퇴한 적이 있었습니다. 다시 말해, '더 남하하다가 얼음에 완전히 갇혀 상륙 자체가 무산될 수 있다'는 시나리오는 상상 속 걱정이 아니라, 같은 바다에서 이미 있었던 일이었습니다.\n\n섀클턴과 워슬리는 빙하만을 그대로 지나쳤습니다. 배는 계속 남쪽으로 나아갔습니다.\n\n며칠 지나지 않아, 1915년 1월 18일에서 19일 사이, 배 주변의 얼음이 밤사이 완전히 닫혔습니다. 갑판에서 내려다봐도 어느 방향으로도 트인 물이 보이지 않았습니다. 다음 날에는 북동풍까지 불어와 얼음을 더욱 조여왔습니다. 인듀어런스호는 완전히 얼음에 갇혔습니다. 바셀만까지는 채 100해리도 남지 않은 지점이었습니다.\n\n섀클턴은 훗날 이렇게 회고했습니다. \"만약 한 달 전에 우리가 여기서 얼음에 갇힐 것을 알았더라면, 나는 저 빙하의 상륙지 중 한 곳에 우리의 기지를 세웠을 것이다.\" 그는 빙하만을 이름 붙인 순간을 두고 \"훗날 후회와 함께 기억하게 되었다\"고 적었습니다.\n\n배는 그 상태로 남극의 겨울을 나며 표류했습니다. 얼음의 압력은 점점 배의 선체를 짓눌렀고, 결국 1915년 11월 21일 인듀어런스호는 부서져 가라앉았습니다. 계획했던 대륙 횡단은 시도조차 되지 못했습니다. 이후 대원들은 유빙 위에서 몇 달을 버티다 구명보트로 엘리펀트섬까지 이동했고, 섀클턴은 그중 다섯 명과 함께 다시 사우스조지아까지 900해리가 넘는 항해를 감행해 구조를 조직했습니다. 스물여덟 명 전원이 살아남았습니다.\n\n오늘날 이 이야기는 흔히 '위기 속에서 대원 전원을 살려낸 위대한 리더십'으로 기억됩니다. 이 명성은 정당합니다. 하지만 그 명성은 배가 이미 얼음에 갇힌 '이후'의 결정들—어떻게 버티고, 어떻게 탈출하고, 어떻게 구조를 조직했는가—에서 비롯된 것입니다. 애초에 얼음을 뚫고 계속 남하하기로 한 이 결정, 즉 빙하만을 지나쳐 간 결정은 그와는 별개의, 더 이른 시점의 판단입니다. 훗날의 영웅적 생존기가 이 앞선 결정까지 자동으로 '옳았다'고 증명해주지는 않습니다.\n\n그렇다면 이 결정 자체는 어떻게 평가해야 할까요. 이 결정은 원정의 실제 목표—대륙 횡단—에 비추어 볼 때 합리적인 논리를 갖추고 있었고, 배가 여전히 전진하고 있다는 사실, 그리고 얼음에 갇혀도 무사히 빠져나온 선례가 있다는 사실에 근거하고 있었습니다. 무모하다고 단정할 수는 없습니다. 하지만 동시에, 이미 구체적으로 받았던 경고를 그 경고가 정확히 가리키는 순간—확실한 대안이 눈앞에 나타난 순간—에 충분히 다시 무게 있게 고려했다고 보기도 어렵습니다. 이런 의미에서 이 결정은 '명백히 훌륭한 판단'도, '명백히 무모한 도박'도 아닌, 정당화는 가능하지만 완전히 검증되지는 않은 선택이었습니다.\n\n그리고 결과는 분명했습니다. 배는 상륙하지 못했고, 결국 파괴되었으며, 원정의 목표는 달성되지 못했습니다. 판단의 질과 결과의 질은 여기서 갈라집니다. 만약 그해가 평년 수준의 얼음 해였다면, 같은 판단이 바셀만 상륙으로 이어졌을 수도 있습니다. 반대로 이미 알려진 경고를 정확히 지나친 순간이었다는 점에서, 이 결과가 완전히 예측 불가능한 불운만은 아니었다고도 말할 수 있습니다.\n\n당신이 그 갑판 위에 서서 빙하만의 평평한 얼음 둔치를 바라보고 있었다면, 그리고 몇 주 전 고래잡이들의 경고를 기억하고 있었다면, 당신은 배를 세웠을까요, 아니면 섀클턴처럼 한 마일이라도 더 남쪽으로 나아가려 했을까요? 그리고 그 선택이 좋은 결과로 이어지지 않았다면, 그것은 판단이 잘못되었기 때문이었을까요, 아니면 애초에 알 수 없었던 그해의 얼음 때문이었을까요."
}
